2013-10-08,CTR20130445,外阴阴道假丝酵母菌病,,中日友好医院,大学第二医院天津医科大学第二医院,南通大学附属医院,兰州大学第一医院,武汉大学中南医院
2013-10-08,CTR20130446,复发性口疮,,湖北省中医院,武汉大学口腔医院,四川省人民医院,南京医科大学附属口腔医院,第四军医大学口腔医院
2014-03-13,CTR20130438,高血压急症,天津医科大学总医院,天津医科大学总医院,海南省人民医院,哈励逊国际和平医院,徐州医学院附属医院,海南省第三人民医院,辽宁省人民医院,遵义医学院附属医院,天津市环湖医院,江苏大学附属医院
2013-10-10,CTR20130448,1.用于治疗厌氧菌感染引起的多种疾病2.用于手术前预防感染和手术后厌氧菌感染的治疗3.治疗男女泌尿生殖道毛滴虫、贾第虫感染，如阴道滴虫病4.治疗消化系统阿米巴虫病，如阿米巴痢疾、阿米巴肝脓肿等,,辽宁中医药大学附属医院国家药物临床试验机构
2016-12-09,CTR20130449,先天性纤维蛋白原减少或缺乏症,天津医科大学总医院,天津医科大学总医院,福建医科大学附属协和医院,福建省漳州市医院,苏北人民医院,江苏省人民医院
2014-04-03,CTR20130451,适用于治疗各种中度至重度疼痛，如创伤性疼痛、手术后疼痛、关节痛、神经痛、癌痛等急性及慢性疼痛,上海长征医院,上海长征医院,上海静安区中心医院,上海市第十人民医院,武汉市普爱医院,华中科技大学同济医学院附属同济医院,上海市中医医院,哈尔滨医科大学附属肿瘤医院
2014-07-16,CTR20130424,乙肝,解放军第三○二医院 新药临床试验室,解放军第三○二医院 新药临床试验室
2013-10-23,CTR20130456,晚期肿瘤,,中国医学科学院肿瘤医院
2014-04-03,CTR20130458,鉴别卡介苗（BCG）接种与结核分枝杆菌感染、肺结核病的临床辅助诊断,上海市公共卫生临床中心,上海市公共卫生临床中心,上海市公共卫生临床中心
2014-05-09,CTR20130452,适用于治疗各种中度至重度疼痛，如创伤性疼痛、手术后疼痛、关节痛、神经痛、癌痛等急性及慢性疼痛,上海长征医院,上海长征医院,包头市中心医院,首都医科大学宣武医院,广西壮族自治区人民医院,山西医科大学第二医院,河北省人民医院
2015-03-19,CTR20130460,用于预防本株流感病毒引起的流行性感冒。,湖南省疾病预防控制中心,湖南省疾病预防控制中心,湘潭县疾病预防控制中心
2015-04-08,CTR20130459,1型或2型糖尿病,中国人民解放军第三军医大学第一附属医院（西南医院）,中国人民解放军第三军医大学第一附属医院国家药物临床试验机构
2014-08-01,CTR20130461,特发性肺纤维症的治疗,广州市精神病医院国家药物临床试验机构,广州市精神病医院国家药物临床试验机构,广州市精神病医院国家药物临床试验机构
2015-03-24,CTR20130457,用于预防本株流感病毒引起的流行性感冒。,广西壮族自治区疾病预防控制中心,广西壮族自治区疾病预防控制中心
2013-10-08,CTR20130463,本品主要用于治疗敏感菌引起中耳道炎、外耳道炎。,,山西医科大学第一医院,山西医科大学第二医院,广西壮族自治区人民医院,青岛市立医院,上海市第一人民医院
2014-10-15,CTR20130464,2型糖尿病,北京协和医院临床药理研究中心I 期研究室,北京协和医院临床药理研究中心I 期研究室,中国医学科学院北京协和医院临床药理研究中心I期研究室
2014-05-09,CTR20130467,适用于治疗各种中度至重度疼痛，如创伤性疼痛、手术后疼痛、关节痛、神经痛、癌痛等急性及慢性疼痛,苏州大学附属第一医院,苏州大学附属第一医院
2014-09-19,CTR20130469,宫颈高危型HPV感染（带下病之湿热瘀滞证）,中国中医科学院广安门医院,中国中医科学院广安门医院,复旦大学附属妇产科医院,北京大学人民医院,中日友好医院,中国医学科学院肿瘤医院,海南医学院附属医院,北京大学第三医院,首都医科大学附属北京友谊医院,中国人民解放军第三军医大学第三附属医院,华中科技大学同济医学院附属同济医院,南京大学医学院附属鼓楼医院,山东大学齐鲁医院,北京大学深圳医院
2013-11-04,CTR20130466,健康受试者,,中南大学湘雅医院Ⅰ期临床研究室
2014-05-04,CTR20130470,疏肝解郁，宁心安神。用于肝郁脾虚所致的郁证。症见忧郁不畅，胸闷胁胀，善太息，失眠多梦，脘痞，嗳气频作，不思饮食，月经不调，舌淡，苔薄白，脉弦。,广东省中医院,广东省中医院,辽宁中医药大学第二附属医院,广东省第二中医院,广州中医药大学第一附属医院,天津中医药大学第一附属医院,南方医科大学附属南方医院,广东省第二中医院,辽宁中医药大学第二附属医院,河南中医学院第一附属医院,天津中医药大学第一附属医院,广州中医药大学第一附属医院
2014-08-20,CTR20130471,1.慢性乙型肝炎，本品适用于治疗慢性乙肝成年患者和12岁以上儿童患者；2.HIV-1感染，本品与其他抗逆转录病毒药物联合治疗HIV-1感染的成年患者和2岁及以上的儿童患者。,四川省人民医院国家药物临床试验机构,四川大学华西药学院临床药学研究中心,四川省人民医院国家药物临床试验机构，中国，四川省，成都市,四川大学华西药学院临床药学研究中心，中国，四川省，成都市,四川省人民医院国家药物临床试验机构,四川大学华西药学院临床药学研究机构
2014-10-23,CTR20130474,拟用于全身麻醉时的静脉诱导,四川大学华西医院麻醉科/麻醉与危重急救研究室,四川大学华西医院,四川大学华西医院
2013-09-29,CTR20130401,高脂血症,,天津中医药大学第二附属医院,黑龙江中医药大学附属第一医院,上海中医药大学附属龙华医院,辽宁中医药大学附属第二医院,长沙市中心医院,长春中医药大学附属医院
2014-11-02,CTR20130476,非精神病性难治性抑郁症,首都医科大学附属北京安定医院,首都医科大学附属北京安定医院,西安交通大学医学院第一附属医院,西京医院,上海精神卫生中心,南京脑科医院,上海同济医院,浙江大学医学院附属第二医院,昆明医学院第一附属医院,广州市脑科医院,中山大学附属第三医院,河北省精神卫生中心/河北省第六人民医院,北京回龙观医院,河南省精神病医院,中南大学湘雅二医院
2014-10-31,CTR20130478,拟用于全身麻醉时的静脉诱导,四川大学华西医院麻醉科/麻醉与危重急救研究室,四川大学华西医院,四川大学华西医院
2014-07-15,CTR20130479,用于铁和叶酸缺乏症的治疗。,苏州大学附属第二医院国家药物临床试验机构,苏州大学附属第二医院国家药物临床试验机构,中国药科大学药物分析教研室
2014-10-27,CTR20130480,拟用于全身麻醉时的静脉诱导,四川大学华西医院麻醉科/麻醉与危重急救研究室,四川大学华西医院,华中科技大学同济医学院附属协和医院,中国医学科学院北京协和医院,中国人民解放军第四军医大学第一附属医院,四川省医学科学院四川省人民医院,中国人民解放军第三军医大学第一附属医院,四川省医学科学院四川省人民医院,中国人民解放军第四军医大学第一附属医院,中国人民解放军第三军医大学第一附属医院,华中科技大学同济医学院附属协和医院,中国医学科学院北京协和医院,四川大学华西医院
2014-05-07,CTR20130481,帕金森病,泰达国际心血管病医院临床试验机构,泰达国际心血管病医院药物临床试验机构,泰达国际心血管病医院药物临床试验机构
2014-06-06,CTR20130485,活血止痛，化瘀止血。血瘀证（软组织损伤），症见疼痛，肿胀，关节活动受限。,成都中医药大学附属医院,成都中医药大学附属医院,天津中医药大学第二附属医院,上海市中医医院,上海中医药大学附属曙光医院,辽宁中医药大学附属医院
2014-05-20,CTR20130486,耐多药结核（MDR-TB）,中南大学临床药理研究所,中南大学临床药理研究所,湖南省肿瘤医院国家药物临床试验机构
2014-04-28,CTR20130487,高血压,航天中心医院,航天中心医院
2014-04-29,CTR20130483,主要用于阿片类物质成瘾患者脱毒后的防复吸治疗,中南大学湘雅二医院,中南大学湘雅二医院,湖北省荆州市公安局强制隔离戒毒所,湖南泰格湘雅药物研究有限公司
2013-10-09,CTR20130491,预防化疗后中性粒细胞减少,,北京大学肿瘤医院,河北省肿瘤医院,内蒙古医学院第一附属医院,山东省肿瘤医院,临沂市肿瘤医院,湖南省肿瘤医院,江苏省肿瘤医院,浙江大学医学院附属第二医院,华中科技大学同济医院附属协和医院,华中科技大学同济医院附属同济医院,武汉大学中南医院,江苏省人民医院
2013-10-09,CTR20130492,预防化疗后中性粒细胞减少,,北京大学肿瘤医院,河北省肿瘤医院,内蒙古医学院第一附属医院,山东省肿瘤医院,临沂市肿瘤医院,湖南省肿瘤医院,江苏省肿瘤医院,浙江大学医学院附属第二医院,华中科技大学同济医院附属协和医院,华中科技大学同济医院附属同济医院,武汉大学中南医院,江苏省人民医院
2014-05-08,CTR20130490,结直肠癌,军事医学科学院附属医院,军事医学科学院附属医院,中国人民解放军总医院,北京肿瘤医院,浙江大学医学院附属第一医院,南昌大学第一附属医院,河北医科大学第四医院
2013-10-09,CTR20130493,预防化疗后中性粒细胞减少,,北京大学肿瘤医院,河北省肿瘤医院,内蒙古医学院第一附属医院,山东省肿瘤医院,临沂市肿瘤医院,湖南省肿瘤医院,江苏省肿瘤医院,浙江大学医学院附属第二医院,华中科技大学同济医院附属协和医院,华中科技大学同济医院附属同济医院,武汉大学中南医院,江苏省人民医院
2013-10-09,CTR20130494,预防化疗后中性粒细胞减少,,北京大学肿瘤医院,河北省肿瘤医院,内蒙古医学院第一附属医院,山东省肿瘤医院,临沂市肿瘤医院,湖南省肿瘤医院,江苏省肿瘤医院,浙江大学医学院附属第二医院,华中科技大学同济医院附属协和医院,华中科技大学同济医院附属同济医院,武汉大学中南医院,江苏省人民医院
2015-01-04,CTR20130462,用于预防结核杆菌感染高危人群肺结核的发病,广西壮族自治区疾病预防控制中心,广西壮族自治区疾病预防控制中心,广西河池市金城江区疾病预防控制中心,广西柳州市柳城县疾病预防控制中心,广西柳州市融水县疾病预防控制中心,广西柳州市疾病预防控制中心,广西柳州市融水县疾病预防控制中心,广西柳州市柳城县疾病预防控制中心,广西河池市金城江区疾病预防控制中心,广西柳州市疾病预防控制中心
2013-10-09,CTR20130495,预防化疗后中性粒细胞减少,,北京大学肿瘤医院,河北省肿瘤医院,内蒙古医学院第一附属医院,山东省肿瘤医院,临沂市肿瘤医院,湖南省肿瘤医院,江苏省肿瘤医院,浙江大学医学院附属第二医院,华中科技大学同济医院附属协和医院,华中科技大学同济医院附属同济医院,武汉大学中南医院,江苏省人民医院
2013-10-09,CTR20130498,预防化疗后中性粒细胞减少,,北京大学肿瘤医院,河北省肿瘤医院,内蒙古医学院第一附属医院,山东省肿瘤医院,临沂市肿瘤医院,湖南省肿瘤医院,江苏省肿瘤医院,浙江大学医学院附属第二医院,华中科技大学同济医院附属协和医院,华中科技大学同济医院附属同济医院,武汉大学中南医院,江苏省人民医院
2013-10-09,CTR20130499,预防化疗后中性粒细胞减少,,北京大学肿瘤医院,河北省肿瘤医院,内蒙古医学院第一附属医院,山东省肿瘤医院,临沂市肿瘤医院,湖南省肿瘤医院,江苏省肿瘤医院,浙江大学医学院附属第二医院,华中科技大学同济医院附属协和医院,华中科技大学同济医院附属同济医院,武汉大学中南医院,江苏省人民医院
2013-10-09,CTR20130500,预防化疗后中性粒细胞减少,,浙江大学医学院附属第二医院,华中科技大学同济医院附属协和医院,华中科技大学同济医院附属同济医院,武汉大学中南医院,湖南省肿瘤医院,江苏省肿瘤医院,河北省肿瘤医院,内蒙古医学院第一附属医院,山东省肿瘤医院,临沂市肿瘤医院,江苏省人民医院,北京大学肿瘤医院
2013-11-15,CTR20130426,治疗非骨髓恶性肿瘤应用化疗引起的贫血,,上海长征医院,上海市第一人民医院,上海市第六人民医院,浙江省肿瘤医院,浙江大学医学院附属邵逸夫医院,辽宁省肿瘤医院,江苏省人民医院,天津市肿瘤医院,四川大学华西医院,河北医科大学第四医院,中国人民解放军沈阳军区总医院,江苏省肿瘤医院
2013-10-23,CTR20130502,过敏性哮喘,,广州医学院第一附属医院,中国人民解放军第四军医大学第一附属医院（西安西京医院）,首都医科大学附属北京朝阳医院,北京大学人民医院,中国医学科学院北京协和医院,天津医科大学第二医院,河北医科大学第二医院,中国医科大学附属第一医院,中国人民解放军沈阳军区总医院,吉林大学第二医院,山东省立医院,中国人民解放军济南军区总医院,青岛市立医院,南京医科大学第一附属医院,东南大学附属中大医院,复旦大学附属中山医院,上海市第一人民医院,中国人民解放军第二军医大学第二附属医院（上海长征医院）,浙江大学医学院附属第一医院,浙江大学医学院附属第二医院,浙江大学医学院附属邵逸夫医院,中国人民解放军南京军区福州总医院,南方医科大学南方医院,广西医科大学第一附属医院,华中科技大学同济医学院附属同济医院,四川大学华西医院,中国人民解放军第三军医大学第二附属医院（重庆新桥医院）,卫生部中日友好医院
2013-10-09,CTR20130501,预防化疗后中性粒细胞减少,,北京大学肿瘤医院,河北省肿瘤医院,内蒙古医学院第一附属医院,山东省肿瘤医院,临沂市肿瘤医院,湖南省肿瘤医院,江苏省肿瘤医院,浙江大学医学院附属第二医院,华中科技大学同济医院附属协和医院,华中科技大学同济医院附属同济医院,武汉大学中南医院,江苏省人民医院
2013-10-09,CTR20130497,预防化疗后中性粒细胞减少,,北京大学肿瘤医院,河北省肿瘤医院,内蒙古医学院第一附属医院,山东省肿瘤医院,临沂市肿瘤医院,湖南省肿瘤医院,江苏省肿瘤医院,浙江大学医学院附属第二医院,华中科技大学同济医院附属协和医院,华中科技大学同济医院附属同济医院,武汉大学中南医院,江苏省人民医院
2013-10-09,CTR20130509,本品适用于由敏感菌所引起的下列感染：1．呼吸道感染：急、慢性支气管炎，感染性支气管扩张症，细菌性肺炎，肺脓肿和术后胸腔感染。2．耳、鼻、喉科感染：鼻窦炎、扁桃腺炎、咽炎。3．泌尿道感染：急、慢性肾盂肾炎、膀胱炎及无症状的菌尿症。4．皮肤和软组织感染：蜂窝织炎、丹毒、腹膜炎及创伤感染。5．骨和关节感染：骨髓炎及脓毒性关节炎。7．淋病：尤其适用于不宜用青霉素治疗者。8．其他感染：包括败血症及脑膜炎；腹部骨盆及矫形外科手术；,,无
2013-10-23,CTR20130513,复发难治的慢性淋巴细胞性白血病（CLL）,,北京大学肿瘤医院,军事医学科学院附属医院,中国医学科学院血液病医院,内蒙古医学院附属医院,昆明医科大学第二附属医院,上海长海医院,南通大学附属医院,第四军医大学唐都医院,四川大学华西医院,山西医科大学第二医院
2014-09-15,CTR20130511,用于治疗普通感冒或流行性感冒引起的呼吸道炎症，缓解咽痒、咽痛、异物感、感冒后咳嗽、鼻塞、流涕、打喷嚏等症状；亦用于缓解发热、头痛、肌肉酸痛、关节痛等症状。,苏州大学附属第二医院,苏州大学附属第二医院
2014-05-04,CTR20130503,用于预防中重度致吐性抗肿瘤化疗引起的恶心和呕吐,北京协和医院临床药理中心,北京协和医院临床药理中心,北京协和医院临床药理中心
2013-10-09,CTR20130514,用于阴道粘膜念珠菌属感染的局部治疗。,,南京医科大学第一附属医院
2014-04-03,CTR20130515,适用于治疗各种中度至重度疼痛，如创伤性疼痛、手术后疼痛、关节痛、神经痛、癌痛等急性及慢性疼痛,苏州大学附属第一医院,苏州大学附属第一医院,苏州大学附属第一医院,湖南省肿瘤医院
2014-04-03,CTR20130516,1.用于治疗厌氧菌感染引起的多种疾病2.用于手术前预防感染和手术后厌氧菌感染的治疗3.治疗男女泌尿生殖道毛滴虫、贾第虫感染，如阴道滴虫病4.治疗消化系统阿米巴虫病，如阿米巴痢疾、阿米巴肝脓肿等,长春中医药大学附属医院,长春中医药大学附属医院,安徽万邦医药科技有限公司
2014-05-15,CTR20130517,恶性淋巴瘤,中国医学科学院北京协和医院,中国医学科学院北京协和医院,中国医学科学院北京协和医院,苏州大学附属第二医院,南京医科大学附属第一医院
2014-05-07,CTR20130518,1.用于治疗厌氧菌感染引起的多种疾病2.用于手术前预防感染和手术后厌氧菌感染的治疗3.治疗男女泌尿生殖道毛滴虫、贾第虫感染，如阴道滴虫病4.治疗消化系统阿米巴虫病，如阿米巴痢疾、阿米巴肝脓肿等,长春中医药大学附属医院,长春中医药大学附属医院,安徽万邦医药科技有限公司
2013-10-13,CTR20130519,痛风伴有高尿酸血症,,北京大学第一医院,吉林大学中日联谊医院,吉林大学第二医院,中国人民解放军白求恩和平医院,山东大学齐鲁医院,中国人民武装警察部队总医院,吉林省人民医院
2015-03-12,CTR20130522,本品适用于各种类型抑郁症，包括伴有焦虑的抑郁症，及广泛性焦虑症。,北京大学第一医院临床药理研究所,北京大学第一医院临床药理研究所
2013-10-10,CTR20130520,本品不仅对精神病阳性症状有效，对阴性症状也有一定效果。适用于急性与慢性精神分裂症的各个亚型，对幻觉妄想型、青春型效果好。也可以减轻与精神分裂症有关的情感症状（如：抑郁、负罪感、焦虑）。对一些用传统抗精神病药治疗无效或疗效不好的病人，改用本品可能有效。本品也用于治疗躁狂症或其他精神病性障碍的兴奋躁动和幻觉妄想。因导致粒细胞减少症，一般不宜作为首选药。,,广州市精神病医院国家药物临床试验机构
2013-10-23,CTR20130473,过敏性哮喘,,第三军医大学第一附属医院
2014-05-07,CTR20130524,高血压，慢性稳定性心绞痛及变异型心绞痛，经血管照影证实的冠心病。,华中科技大学同济医学院附属同济医院,华中科技大学同济医学院附属同济医院
2015-01-13,CTR20130532,行气活血，化瘀通络。用于治疗神经根型颈椎病的气滞血瘀证，症见颈项强痛，肩臂疼痛，手臂酸胀，手臂窜麻，上肢乏力。,湖北省中医院,湖北省中医院,湖南中医药大学第二附属医院,广西中医药大学附属瑞康医院,辽宁中医药大学附属医院,湖南中医药大学第一附属医院
2013-11-19,CTR20130534,晚期肿瘤患者,,中国医学科学院肿瘤医院
2015-06-12,CTR20130539,敏感菌所致的各种中、重度细菌性感染,成都军区总院,成都军区总医院临床试验机构
2018-05-30,CTR20130531,拟用于全身麻醉时的静脉诱导,四川大学华西医院麻醉科/麻醉与危重急救研究室,四川大学华西医院
2015-01-07,CTR20130541,2型糖尿病,中国中医科学院广安门医院,中国中医科学院西苑医院,辽宁中医药大学附属医院,辽宁中医药大学附属第二医院,河南省中医药研究院,湖南中医药大学第一附属医院,长春中医药大学附属医院,吉林省中西医结合医院,白求恩国际和平医院
2013-11-19,CTR20130536,晚期肿瘤患者,,中国医学科学院肿瘤医院
2013-10-10,CTR20130543,适用于预防同种异体肾、肝、心、骨髓等器官或组织移植所发生的排斥反应，也适用于预防及治疗骨髓移植时发生的移植物抗宿主反应。本品常与肾上腺皮质激素等免疫抑制剂联合应用，以提高疗效。近年来有报道试用于治疗眼色素层炎、重型再生障碍性贫血及难治性自身免疫性血小板减少性紫癜、银屑病、难治性狼疮肾炎等。,,中国药科大学,第四军医大学西京医院国家药品临床研究基地
2013-10-23,CTR20130540,慢性B淋巴细胞性白血病,,北京肿瘤医院
2015-04-09,CTR20130546,发热,首都医科大学附属北京儿童医院,首都医科大学附属北京儿童医院,第四军医大学第一附属医院 西京医院,吉林大学第一医院,中国医科大学附属盛京医院,上海交通大学附属儿童医学中心,上海市儿童医院,昆明医科大学第二附属医院,厦门大学附属第一医院
2013-10-10,CTR20130545,冠心病的长期治疗、预防血管痉挛型和混合型心绞痛，也适用于心肌梗死后的治疗及慢性,,辽宁中医药大学附属医院国家药物临床试验机构
2014-10-27,CTR20130549,未经治疗的基因1型丙型肝炎病毒感染（慢性）,中国医学科学院北京协和医院药理研究中心,中国医学科学院北京协和医院
2013-11-22,CTR20130552,用于治疗费城染色体阳性的慢性髓性白血病(Ph+CML)的慢性期、加速期或急变期；用于治疗不能切除和/或发生转移的恶性胃肠道间质肿瘤（GIST）的成人患者；用于以下适应症的安全有效性信息主要来自国外研究资料，中国人群数据有限： 用于治疗成人复发的或难治的费城染色体阳性的急性淋巴细胞白血病（Ph+ ALL）；用于治疗嗜酸细胞过多综合症（HES）和/或慢性嗜酸粒细胞白血病（CEL）伴有FIP1L1-PDGFRα融合激酶的成年患者； 用于治疗骨髓增生异常综合症/骨髓增生性疾病（MDS/MPD）伴有血小板衍生生长因子受体（PDGFR）基因重排的成年患者；用于治疗侵袭性系统性肥大细胞增生症(ASM)，无D816V c-Kit基因突变或未知c-Kit基因突变的成人患者；用于治疗不能切除，复发的或发生转移的隆突性皮肤纤维肉瘤（DFSP）；用于Kit（CD117）阳性GIST手术切除后具有明显复发风险的成人患者的辅助治疗。极低及低复发风险的患者不应该接受该辅助治疗。,,中南大学湘雅医院国家药物临床试验机构
2013-10-10,CTR20130551,适用于预防同种异体肾、肝、心、骨髓等器官或组织移植所发生的排斥反应，也适用于预防及治疗骨髓移植时发生的移植物抗宿主反应。本品常与肾上腺皮质激素等免疫抑制剂联合应用，以提高疗效。近年来有报道试用于治疗眼色素层炎、重型再生障碍性贫血及难治性自身免疫性血小板减少性紫癜、银屑病、难治性狼疮肾炎等。,,中国药科大学,第四军医大学西京医院国家药品临床研究基地
2015-02-03,CTR20130556,用于17岁及以上癫痫部分性发作患者的辅助治疗,首都医科大学附属北京天坛医院,首都医科大学附属北京天坛医院,天津医科大学总医院,吉林大学第一医院,中国人民解放军沈阳军区总医院,山西医科大学第一医院,青岛大学医学院附属医院,哈励逊国际和平医院,沧州市中心医院,宁夏医科大学附属医院,贵阳医学院附属医院,长沙市第三医院,中南大学湘雅二医院,常德市第一人民医院,广东医学院附属医院,徐州医学院附属医院,桂林医学院附属医院,中南大学湘雅医院
2013-10-11,CTR20130544,高血压、稳定性心绞痛,,华中科技大学同济医学院附属协和医院新药临床试验机构
2014-05-19,CTR20130555,用于治疗成人抑郁症,中南大学湘雅三医院Ⅰ期临床研究室,中南大学湘雅三医院Ⅰ期临床研究室
2014-11-13,CTR20130553,用于治疗费城染色体阳性的慢性髓性白血病(Ph+ CML)的慢性期、加速期或急变期,中南大学湘雅医院Ⅰ期临床研究室,湖南泰格湘雅药物研究有限公司,中南大学湘雅医院Ⅰ期临床研究室,湖南泰格湘雅药物研究有限公司
2014-08-21,CTR20130559,痔急性发作及痔术后肛门症状,首都医科大学附属北京朝阳医院,首都医科大学附属北京朝阳医院,北京大学第三医院,湖南省人民医院,中国人民解放军沈阳军区总医院,北京大学首钢医院,中国人民解放军沈阳军区总医院,北京大学首钢医院,北京大学第三医院,首都医科大学附属北京朝阳医院,湖南省人民医院
