2015-06-02,CTR20130535,肝细胞癌,中国医学科学院肿瘤医院,中国人民解放军第八一医院,中国医学科学院肿瘤医院,中国人民解放军第八一医院,中国人民解放军第三〇七医院,青岛大学附属医院,吉林省肿瘤医院,青岛大学医学院附属医院,中国人民解放军第三〇七医院,中国人民解放军第八一医院,中国医学科学院肿瘤医院,吉林省肿瘤医院
2013-10-25,CTR20130924,脑梗死,,中国人民解放军济南军区总医院,武汉大学中南医院,苏州大学附属第二医院,河北医科大学第三医院,四平市中心人民医院,南京医科大学第二附属医院,中国人民解放军第251医院,南华大学附属第二医院,上海市第一人民医院
2013-10-25,CTR20130923,脑梗死,,中国人民解放军济南军区总医院,武汉大学中南医院,苏州大学附属第二医院,河北医科大学第三医院,四平市中心人民医院,南京医科大学第二附属医院,中国人民解放军第251医院,南华大学附属第二医院,上海市第一人民医院
2013-11-14,CTR20130926,适用于高胆固醇血症和家族性高胆固醇血症患者,,广州市精神病医院国家药品临床研究基地
2015-09-18,CTR20130920,中度干眼伴浅层点状角膜病变,首都医科大学附属北京同仁医院,首都医科大学附属北京同仁医院,北京大学第一医院,天津市眼科医院,复旦大学附属眼耳鼻喉科医院,武汉大学人民医院,中山大学中山眼科中心
2013-11-14,CTR20130927,适用于高胆固醇血症和家族性高胆固醇血症患者,,广州市精神病医院国家药品临床研究基地
2014-04-29,CTR20130928,支气管哮喘慢性持续期（热哮证）,天津中医药大学第一附属医院,天津中医药大学第一附属医院,长春中医药大学附属医院,山西省中医院,湖南中医药大学第一附属医院,湖北省中医院,湖南中医药大学第一附属医院,湖北省中医院,长春中医药大学附属医院,天津中医药大学第一附属医院,山西省中医院
2013-11-08,CTR20130929,局部晚期或转移性非小细胞肺癌,,上海市胸科医院,上海市肺科医院,吉林省肿瘤医院,中国人民解放军307医院,天津市肿瘤医院,四川大学华西医院,福建省肿瘤医院,广西省肿瘤医院,华中科技大学同济医学院附属武汉同济医院,中国医科大学附属第一医院,江苏省肿瘤医院
2013-11-14,CTR20130930,适用于高胆固醇血症和家族性高胆固醇血症患者,,广州市精神病医院国家药品临床研究基地
2015-06-04,CTR20130934,类风湿性关节炎,北京大学人民医院,北京大学人民医院,中日友好医院,安徽省立医院,安徽医院大学第一附属医院,上海光华中西医结合医院,广东省人民医院,中南大学湘雅二医院,蚌埠医学院附属医院,华中科技大学同济医学院附属同济医院,山东大学齐鲁医院,中南大学湘雅医院,昆明医学院第一附属医院,天津医学大学总医院,复旦大学附属中山医院,萍乡市人民医院,四川大学华西医院,汕头大学医学院第一附属医院,江苏省人民医院,上海交通大学医学院附属仁济医院,宁波市第一医院,盐城市第一人民医院,株洲市中心医院,Hopital Dupuytren,Rheuma Praxis Bayreuth,Credit Valley Rheumatology,Indiana University,Seoul National University Hospital/Rheumatology
2013-10-25,CTR20130937,清热利湿、活血化瘀、通腑泄浊。用于瘀血内阻、湿热蕴结引起的腰膝酸痛，小便不利、大便干结，肢体浮肿及慢性肾小球肾炎所致蛋白尿、血尿。,,北京中医药大学东直门医院,首都医科大学附属北京市中医医院,第三军医大学第二附属医院,云南省中医医院,上海交通大学医学院附属新华医院,成都军区昆明总医院,上海长征医院
2014-08-19,CTR20130941,伴有细菌感染的浅部真菌病，如手癣、足癣、体癣、股癣,浙江大学医学院附属第二医院,浙江大学医学院附属第一医院,广西医科大学第一附属医院,浙江大学医学院附属第二医院,广西医科大学第一附属医院,浙江大学医学院附属第一医院,浙江大学医学院附属第一医院,浙江大学医学院附属第二医院,广西医科大学第一附属医院
2014-11-27,CTR20130936,类风湿性关节炎,北京大学人民医院,北京大学人民医院,安徽省立医院,安徽医科大学第一附属医院,上海光华中西医结合医院,广东省人民医院,中南大学湘雅二医院,蚌埠医学院附属医院,华中科技大学同济医学院附属同济医院,山东大学齐鲁医院,中南大学湘雅医院,昆明医学院第一附属医院,天津医科大学总医院,复旦大学附属中山医院,萍乡市人民医院,四川大学华西医院,汕头大学医学院第一附属医院,江苏省人民医院,山西医科大学第二医院,上海交通大学医学院附属仁济医院,中日友好医院,宁波市第一医院,盐城市第一人民医院,株洲市中心医院
2014-04-29,CTR20130942,失眠症(心血亏虚、肾精不足证),中国中医科学院广安门医院,中国中医科学院广安门医院,吉林省中研医院,辽宁中医药大学附属第二医院,湖南中医药大学第一附属医院,河南省中医院,河北省人民医院,河南中医学院第一附属医院,河北省人民医院,河南省中医院,河南中医学院第一附属医院,辽宁中医药大学附属第二医院,吉林省中研医院,中国中医科学院广安门医院,湖南中医药大学第一附属医院
2013-11-21,CTR20130943,用于治疗胸中憋闷、冠心病、心绞痛，亦可用于心肌梗塞。,,辽宁中医药大学附属第二医院
2013-10-31,CTR20130945,膝骨性关节炎,,江西中医学院附属医院,广西中医药大学第一附属医院,福建省中医药研究院,上海市中医医院
2013-10-31,CTR20130949,腰椎骨性关节炎,,江西中医学院附属医院,广西中医药大学第一附属医院,福建省中医药研究院,上海市中医医院
2014-06-24,CTR20130950,1）消化道肿瘤（2）头颈部肿瘤（3）乳腺癌,江苏省肿瘤医院,江苏省肿瘤医院,南京市鼓楼医院,常州市第一人民医院,安徽医科大学第一附属医院,南昌大学第二附属医院,大连医科大学第一附属医院,武汉大学中南医院,浙江省肿瘤医院,粤北人民医院,湖北省肿瘤医院
2015-06-01,CTR20130951,人乳头瘤病毒HPV16和HPV18感染及因此引发的宫颈癌等疾病,中国医学科学院肿瘤医院,中国医学科学院肿瘤医院,北京大学人民医院,广西壮族自治区柳州市疾病预防控制中心,江苏省疾病预防控制中心,中国食品药品检定研究院,广西壮族自治区柳州市疾病预防控制中心,北京大学人民医院,中国食品药品检定研究院,江苏省疾病预防控制中心
2014-11-26,CTR20130952,HER2阳性晚期乳腺癌,复旦大学附属肿瘤医院,复旦大学附属肿瘤医院,北京肿瘤医院,江苏省肿瘤医院,中山大学附属肿瘤医院,西安交通大学医学院第一附属医院,天津市肿瘤医院,第三军医大学附属西南医院,第四军医大学西京医院,哈尔滨医科大学附属肿瘤医院,CPMC; Service d'Oncologie Médicale,Centro Oncologico Riojano Integral (CORI),Instituto de Oncología de Rosario,AUSTIN AND REPATRIATION MEDICAL CENTRE; CANCER SERVICES,CANBERRA HOSPITAL; MEDICAL ONCOLOGY,HOCA Chermside,ROYAL MELBOURNE HOSPITAL; HEMATOLOGY AND MEDICAL ONCOLOGY,Royal Prince Alfred Hospital; Medical Oncology,LKH SALZBURG - UNIV. KLINIKUM SALZBURG; III. MEDIZINISCHE ABT.,LKH-UNIV. KLINIKUM GRAZ; Klinische Abteilung für Onkologie,UNIVERSIT？TSKLINIK FüR FRAUENHEILKUNDE; KLINIK FüR GYN？KOLOGIE IV,KH Der Barmherzigen Schwestern; Abteilung für Innere Medizin 1,UNIVERSITAIR ZIEKENHUIS BRUSSEL; ONCOLOGY,UNIVERSITAIR ZIEKENHUIS; ONCOLOGIE - CANCEROLOGIE,U.Z. GASTHUISBERG; ONCOLOGY,CHU Sart Tilman,Hospital Amaral Carvalho,Hospital das Clinicas - FMUSP Ribeirao Preto,Hospital Perola Byington,Hospital Sao Jose,Hospital Sao Lucas - PUCRS,HOSPITAL SIRIO LIBANES; CENTRO DE ONCOLOGIA,ONCOLOGISTAS ASSOCIADOS,BCCA - VANCOUVER ISLAND CANCER CENTRE; ONCOLOGY,Capital Health; QEII HSC; Oncology,CHUM - HOTEL DIEU DE MONTREAL,CROSS CANCER INSTITUTE ; DEPT OF MEDICAL ONCOLOGY,CSSS champlain - Charles-Le Moyne,GRAND RIVER REGIONAL CANCER CENTRE,McGill University; Sir Mortimer B Davis Jewish General Hospital; Oncology,SUNNYBROOK ODETTE CANCER CENTRE,William Osler Health System Brampton Civic Hospital,HOSPITAL SOLCA PORTOVIEJO; ONCOLOGIA,HOSPITAL SOLCA QUITO; ONCOLOGIA,Manial Specialized Hospital; Oncology,NCI; ONCOLOGY DEPT,North Estonia Medical Centre Foundation; Oncology Center,Tartu University Hospital; Clinic of Hematology and Oncology,HELSINKI UNIVERSITY CENTRAL HOSPITAL; ONCOLOGY CLINICS,SATAKUNTA CENTRAL HOSPITAL; ONCOLOGY,TAMPERE UNIVERSITY HOSPITAL; DEPT OF ONCOLOGY,TURKU UNI CENTRAL HOSPITAL; ONCOLOGY CLINICS,Centre Azureen De Cancerologie; Cons externes,CENTRE CATALAN D' ONCOLOGIE,CENTRE EUGENE MARQUIS; UNITE HUGUENIN,Centre Georges Francois Leclerc; Oncologie 3,CENTRE HOSPITALIER FLEYRIAT; ONCOLOGIE/HEMATOLOGIE,Centre Leonard De Vinci;Chimiotherapie,Centre Leon Berard; Departement Oncologie Medicale,Centre Rene Huguenin; ONCOLOGIE GENETIQUE,Chp Saint Gregoire; Cancerologie Radiotherapie,CLINIQUE CHENIEUX; ONCOLOGY,Institut D Oncologie Medical,Clinique De L Europe; Radiotherapie Chimiotherapie,Clinique Du Docteur Calabet; Cromg,Clinique Radio Des Dentellieres; Chimiotherapie Radiotherapie,CLINIQUE SAINTE MARGUERITE; ONCOLOGIE MEDICALE,Clinique Victor Hugo,Crlcc Paul Papin; Oncologie Medicale,Hopital Cochin; Unite Fonctionnelle D Oncologie,Ico Rene Gauducheau; Oncologie,Institut Claudius Regaud; Departement Oncologie Medicale,Institut Curie; Oncologie Medicale,INSTITUT PAOLI CALMETTES; ONCOLOGIE MEDICALE,POLYCLINIQUE BORDEAUX NORD AQUITAINE; CHIMIOTHERAPIE RADIOTHERAPIE,POLYCLINIQUE DE BLOIS; CHIMIOTHERAPIE AMBULATOIRE,Polyclinique De Courlancy; Centre Radiotherapie Oncologie,Polyclinique Du Languedoc; Chimiotherapie,Hopital Prive Drome Ardeche; Hopital De Jour,HOPITAL SAINT LOUIS; SERVICE ONCO THORACIQUE,Agaplesion Diakonieklinikum Rotenburg,EV. KRANKENHAUS BETHESDA; M？NCHENGLADBACH GGMBH,"Gynaekologisch-Onkologische Schwerpunktpraxis Prof. Dr. med. Lueck, Dr. Schrader und Dr. Noeding",Gyn？kologicum Bremen Prof.Dr. Willibald Schr？der,Klinikum am Bruderwald; Frauenklinik,Klinikum Esslingen Klinik f. Frauenheilkunde und Geburtshilfe,Klinikum rechts der Isar - Technische Uni München; Frauenklinik & Poliklinik,Kreiskrankenhaus Torgau Abt.Gyn？kologie und Geburtshilfe,Nationales Centrum für Tumorerkrankungen (NCT),Praxis Dr. Wagner,"Ruppiner Kliniken, Klinik fuer Gynaekologie und Geburtshilfe",SRH Wald-Klinikum Gera Klinik f.Frauenheilkunde und Geburtshilfe,St.-Vincenz-Krankenhaus Frauenklinik,Uniklinik Tübingen; Frauenklinik,Universitaetsklinikum des Saarlandes; Klinik f. Frauenheilkunden und Geburtshilfe,Universitatsklinikum Erlangen; Frauenklinik,Universitatsklinikum Essen; Zentrum Für Frauenheilkunde,Universitatsklinikum Hamburg-Eppendorf; Frauenklinik,Universitatsklinikum Schleswig-Holstein / Campus Lübeck; Klinik für Frauenheilkunde und Geburtshilfe,AGAPLESION Markus-Krankenhaus),Papageorgiou General Hospital; Medical Oncology,University General Hospital of Heraklion,UNIVERSITY HOSPITAL OF LARISSA; ONCOLOGY,UNIVERSITY HOSPITAL OF PATRAS; MEDICAL ONCOLOGY,QUEEN ELIZABETH HOSPITAL; CLINICAL ONCOLOGY,BORSOD-ABAUJ-ZEMPLEN MEGYEI KORHAZ ES EGYETEMI OKTATO KORHAZ; ONKOLOGIAI OSZTALY,DEBRECENI EGYETEM ORVOS ES EGESZSEGTUDOMANYI CENTRUM; ONKOLOGIAI TANSZEK,FOVAROSI SZENT LASZLO KORHAZ-RENDELOINTEZET; ONKOLOGIAI OSZTALY,ORSZAGOS ONKOLOGIAL INTEZET; ONKOLOGIAI OSZTALY,SZEGEDI TUDOMANYEGYETEM SZENT GYORGYI ALBERT ORVOS ES GYOGYSZERES; ONKOTERAPIAS KLINIKA,Fov.Onk.Szt Janos Korh. E-Budai Egyesitett Korhazai,Assuta Medical Centre; Oncology,CHAIM SHEBA MEDICAL CENTER; ONCOLOGY DEPT,HADASSAH EIN KAREM HOSPITAL; ONCOLOGY DEPT,KAPLAN MEDICAL CENTER; ONCOLOGY INST.,NAHARIYA HOSPITAL; ONCOLOGY,Rabin Medical Center; Oncology Dept,RAMBAM MEDICAL CENTER; ONCOLOGY,SOROKA MEDICAL CENTER; ONCOLOGY DEPT,SOURASKY / ICHILOV HOSPITAL; DEPT. OF ONCOLOGY,ASSAF HAROFEH; ONCOLOGY,ARCISPEDALE S.ANNA; ONCOLOGIA MEDICA,Azienda Ospedaliera Papa Giovanni XXIII;Oncologia Medica,Azienda Ospedaliera San Giuseppe Moscati,AZIENDA OSPEDALIERO-UNIVERSITARIA CAREGGI;S.C. ONCOLOGIA MEDICA 1,AZIENDA OSPEDALIERO-UNIVERSITARIA DIPARTIMENTO INTERAZIENDALE DI ONCOLOGIA,Azienda USL di Ravenna; Unità Operativa di Oncologia Medica,AZ. OSP. OSPEDALE CIVILE; U.O. DI ONCOLOGIA MEDICA ED EMATOLOGIA,Ente Ospedaliero Ospedali Galliera; S.C. Oncologia Medica,Fondazione Del Piemonte; Medical Oncology,Irccs Istituto Europeo Di Oncologia (IEO),Irccs Ospedale San Raffaele;Oncologia Medica,IRCCS POLICLINICO S. MATTEO - UNI PAVIA; CLINICA MEDICA I DIV. MED. INT. ONC. MEDICA E GASTROENT.,OSPEDALE BELCOLLE DI VITERBO; ONCOLOGIA,OSPEDALE DEGLI INFERMI DI BIELLA; REPARTO ONCOLOGIA MEDICA,Ospedale Di Macerata; Oncologia,OSPEDALE MAGGIORE DELLA CARITA; ONCOLOGIA MEDICA,OSPEDALE MATER SALUTIS; DEPT OF ONCOLOGY,OSPEDALE S. VINCENZO; ONCOLOGIA MEDICA,OSPEDALI RIUNITI DI ANCONA; ONCOLOGY,American University of Beirut - Medical Center,HOTEL DIEU DE FRANCE; ONCOLOGY,Lithuanian University of Health. Sciences Kauno klinikos,UNI ONCOLOGY INST. ; CHEMO - RADIATION DEPT,Cancerologia de Queretaro; Oncologia,CENTRO MEDICO NACIONAL SIGLO XXI - IMSS; HOSPITAL DE ONCOLOGIA,HOSPITAL GENERAL DE MéXICO; UNIDAD DE ONCOLOGIA,HOSPITAL HMG COYOACAN,IEM-FUCAM,INSTITUTO NACIONAL DE CANCEROLOGIA; ONCOLOGY,INSTITUTO NACIONAL DE CIENCIAS MéDICAS Y DE LA NUTRICION ZUBIRáN,Medica Sur Centro Oncologico Integral,Institut National D'oncologie Sidi Mohammed Ben Abdellah; Anatomopathologie,ALBERT SCHWEITZER ZIEKENHUIS; INWENDIGE GENEESKUNDE,Catharina ZKHS; Inwendige Geneeskunde Afd.,IKAZIA ZIEKENHUIS; INTERNE ONCOLOGIE,MARTINI ZIEKENHUIS; DEPT OF INTERNAL MEDICINE,"MC HAAGLANDEN, LOCATIE ANTONIUSHOVE; INTERNE GENEESKUNDE",MEDISCH CENTRUM ALKMAAR,TWEE STEDEN ZIEKENHUIS - LOCATIE TILBURG; INTERNE GENEESEKUNDE,Vie Curie,Hameed Latif Hospital; Department of Oncology,Shaukat Khanum Memorial Cancer Hospital; Department of Oncology,Shifa International Hospital; Department of Oncology,Hospital Nacional LNS dela Policia Nacional del Perú. Unidad Onco; Deapartamento de Oncología,Instituto;Oncologico Miraflores,Bialostockie Centrum Onkologii; Oddzial Onkologii Klinicznej,"Cent.Onkologii-Instytut im. M. S-Curie, Klinika Now. Piesi i Chirurgii Rekon.","Europejskie Centrum Zdrowia Otwock Szpital im. Fryderyka Chopina, Klinika Onkologii","Szpital Uniwersytecki w Krakowie, Oddzia？ Kliniczny Kliniki Onkologii",Wojewodzki Szpital Specjalistyczny im. M. Kopernika;Oddzial Chemioterapii,？wi？tokrzyskie Centrum Onkologii;,Hospital da Luz; Departamento de Oncologia Medica,Hospital de Santa Maria; Servico de Oncologia Medica,Hospital de Sao Joao; Servico de Oncologia,Inst Portugues Oncologia Coim; Oncologia Medica,IPO do Porto; Servico de Oncologia Medica,"King Abdul Aziz Medical City, King Fahd National Guard; Oncology",KING FAISAL SPECIALIST HOSPITAL & RESEARCH CENTRE; ONCOLOGY,Institute for Oncology of Vojvodina,Institute for Onc/Rad Serbia,INSTITUTE OF ONCOLOGY LJUBLJANA,Centro Oncologico MD Anderson Internacional; Servicio de Oncologia,Clinica Universitaria de Navarra; Servicio de Oncologia,Complejo Asistencial Universitario De Burgos; Servicio de Oncologia,Complejo Asistencial Universitario de Leon; Servicio de Oncologia,Complejo Hospitalario de Orense; Servicio de Oncologia,Complejo Hospitalario Nuestra Se？ora de la Candelaria; Servicio de Oncologia,Complejo Hospitalario Universitario de Santiago (CHUS) ; Servicio de Oncologia,Fundacion Hospital de Alcorcon; Servicio de Oncologia,Fundacion Jimenez Diaz; Servicio de Oncologia,Hospital Arnau de Vilanova (Valencia) Servicio de Oncologia,Hospital Clínic i Provincial; Servicio de Hematología y Oncología,Hospital Clinico Universitario de Salamanca; Servicio de Oncologia,Hospital Clinico Universitario de Valladolid; Servicio de Oncologia,Hospital Clinico Universitario Virgen de la Victoria; Servicio de Oncologia,Hospital de Barbastro; Servicio de Oncologia,Hospital de Basurto; Servicio de Oncologia,Hospital de Cabue？es; Servicio de Oncologia,Hospital de Gran Canaria Dr. Negrin; Servicio de Oncologia,Hospital de Jerez de la Frontera; Servicio de Oncologia,Hospital de la Santa Creu i Sant Pau; Servicio de Oncologia,HOSPITAL DE MADRID NORTE SANCHINARRO- CENTRO INTEGRAL ONCOLOGICO CLARA CAMPAL; Servicio de Oncologia,Hospital de Navarra; Servicio de Oncologia,Hospital de Rio Hortega; Servicio de Oncologia,Hospital de Sagunto; Servicio de Oncologia,Hospital General de Elda; Servicio de Oncologia,Hospital General Universitario de Guadalajara; Servicio de Oncologia,Hospital General Universitario J.M  Morales Meseguer; Servicio de Oncologia,Hospital Provincial de Castellon; Servicio de Oncologia,Hospital Quiron Barcelona; Servicio de Oncologia,Hospital Ramon y Cajal; Servicio de Oncologia,Hospital San Pedro De Alcantara; Servicio de Oncologia,Hospital Severo Ochoa; Servicio de Oncologia,Hospital Universitari de Girona Dr. Josep Trueta; Servicio de Oncologia,Hospital Universitario 12 de Octubre; Servicio de Oncologia,Hospital Universitario Clínico San Carlos; Servicio de Oncologia,Hospital Universitario Dr. Peset,Hospital Universitario La Paz; Servicio de Oncologia,HOSPITAL UNIVERSITARIO SON ESPASES,Hospital Universitario Virgen de Arrixaca; Servicio de Oncologia,Hospital Universitario Virgen de las Nieves; Servicio de Oncologia,Hospital Universitario Virgen Macarena; Servicio de Oncologia,Hospital Universitari Sant Joan de Reus; Servicio de Oncologia,"Centrallasarettet V？xj？, Onkologkliniken","Centralsjukhuset Karlstad, Onkologkliniken",Gavle Sjukhus; Onkologiska Kliniken,Sahlgrenska Universitetssjukhuset; Jubileumskliniken,"Skanes University Hospital, Sk？nes Department of Onclology","Vastmanlands sjukhus V？ster？s, Onkologkliniken",Akdeniz University Medical Faculty; Medical Oncology Department,Baskent Uni. Practice and Research Hospital; Medical Oncology,Ege University Medical Faculty; Medical Oncology Department,HACETTEPE UNI MEDICAL FACULTY HOSPITAL; ONCOLOGY DEPT,Trakya University Medical Faculty Research And Practice Hospital Medical Oncology Department,Kyiv City Clinical Oncological Center; Chemotherapy Department,"Mun. Multifield Clin.Hosp.#4,Dept. of Chemotherapy, DSMU; Chair of Oncology and Medical Radiology",State Oncology Regional Treatment-Diagnostic Center; Chemotherapy Department,ZAPOROZHYE REGIONAL ONCOLOGY HOSPITAL; DEPT OF ONCOLOGY,Tawam Hospital,Addenbrookes Hospital; Dept of Oncology,Barts and the London NHS Trust.,BEATSON WEST OF SCOTLAND CANCER CENTRE,Christie Hospital; Breast Cancer Research Office,Churchill Hospital,City Hospital NHS Trust,DERRIFORD HOSPITAL; PLYMOUTH ONCOLOGY CENTRE,Diana Princess of Wales Hosp.,Eastbourne District Hospital; Department of Pharmacy,FREEMAN HOSPITAL; NORTHERN CENTRE FOR CANCER CARE,HAIRMYRES HOSPITAL; ONCOLOGY DEPT,HUDDERSFIELD ROYAL INFIRMARY,JAMES COOK UNI HOSPITAL,Leeds Teaching Hosp NHS Trust;St James's Institute of Onc,Macclesfield District General Hospital,Mount Vernon Cancer Centre,Musgrove Park Hospital,Peterborough City Hospital,Royal Cornwall Hospital,ROYAL DERBY HOSPITAL,ROYAL FREE HOSPITAL; DEPT OF ONCOLOGY,Royal Marsden Hospital,Royal Surrey County Hospital,Royal United Hospital; Oncology Department,Wishaw General Hospital,The Royal Marsden Hospital,University Hospital of North Durham,Velindre Hospital,WALSGRAVE HOSPITAL,Grupo Oncológico Cooperativo Uruguayo; Hospital de Clínicas - Dpto. de Oncología,Hospital Central De Las FF.AA.; Servicio De Oncologia,Hospital Pereira Rossell; Oncology Department,Centro Integral de Oncología,Centro Médico Docente La Trinidad; Servicio de Gastroenterología,Instituto Oncológico Luis Razetti,ANTICANCER HOSPITAL AG. SAVAS ; 2ND DEPT. OF ONCOLOGY - INTERNAL MEDICINE,Euromedical General Clinic of Thessaloniki; Oncology Department,HIPPOKRATIO HOSPITAL; 2ND INTERNAL MEDICINE,哈尔滨医科大学附属肿瘤医院,北京肿瘤医院,江苏省肿瘤医院,中山大学附属肿瘤医院,西安交通大学医学院第一附属医院,天津市肿瘤医院,第三军医大学附属西南医院,第四军医大学西京医院,华中科技大学同济医学院附属同济医院
2015-03-04,CTR20130953,抗微循环障碍：前庭功能紊乱引起的眩晕症；偏头痛。,广州市精神病医院国家药物临床试验机构,广州市精神病医院国家药物临床试验机构,广东岭南制药有限公司
2015-01-30,CTR20130956,晚期恶性肿瘤,天津市肿瘤医院,天津市肿瘤医院,科文斯医药研发(上海)有限公司
2013-10-31,CTR20130955,颈型颈椎病,,江西中医学院附属医院,广西中医药大学第一附属医院,福建省中医药研究院,上海市中医医院
2015-01-26,CTR20130957,早期特发性帕金森病和伴有波动现象的晚期帕金森病,上海市徐汇区中心医院,上海市徐汇区中心医院
2014-04-29,CTR20130958,本品适用于重症监护治疗期间最初插管和使用呼吸机病人的镇静。,中南大学湘雅三医院,中南大学湘雅三医院
2014-04-01,CTR20130959,转移性胃食管癌（HER2阴性）,复旦大学附属肿瘤医院,复旦大学附属肿瘤医院,军事医学科学院附属医院,北京肿瘤医院,中山大学肿瘤防治中心,邵逸夫医院,中国人民解放军第八一医院,南京军区福州总医院,吉林大学第一附属医院,上海市第一人民医院,吉林省肿瘤医院,BOX HILL HOSPITAL; ONCOLOGY,CONCORD REPATRIATION GENERAL HOSPITAL; ONCOLOGY,MONASH MEDICAL CENTRE; ONCOLOGY,North Coast Cancer Institute,Hamilton Health Sciences - General Site,McGill University; Sir Mortimer B Davis Jewish General Hospital; Pharmacy,MOUNT SINAI HOSPITAL; ONCOLOGY,Princess Margaret Hospital; Department of Med Oncology,Crlcc Paul Papin; Oncologie Medicale,Hopital Morvan,Hopital Beaujon; Oncologie,HOPA im Struensee-Haus Dres. Erik Engel Wiebke Hollburg,Kliniken Ludwigsburg-Bietigheim gGmbH Klinikum Ludwigsburg,Klinik Rechts der Isar - Technische Uni München; III Medizinische Klinik (H？matologie/Onkologie),PAMELA YOUDE NETHERSOLE EASTERN HOSPITAL; CLINICAL ONCOLOGY,QUEEN MARY HOSPITAL; DEPT. OF CLINICAL ONCOLOGY,TUEN MUN HOSPITAL; CLINICAL ONCOLOGY,吉林省肿瘤医院,中山大学肿瘤防治中心,复旦大学附属肿瘤医院,军事医学科学院附属医院,北京肿瘤医院,南京八一医院,吉林大学第一附属医院,上海市第一人民医院,邵逸夫医院,南京军区福州总医院
2015-02-02,CTR20130961,早期特发性帕金森,北京协和医院,北京协和医院,武汉大学人民医院,复旦大学附属华山医院,浙江大学医学院附属第二医院,华中科技大学同济医学院协和医院,四川大学华西医院,苏州大学附属第二医院,上海长征医院,广州医学院第一附属医院神经内科,中山医科大学第一附属医院,吉林大学第一医院,浙江大学医学院附属邵逸夫医院,中山大学孙逸仙纪念医院,广东省人民医院,天津医科大学总医院,浙江大学医学院附属第一医院,北京大学第三医院,武汉大学人民医院,福建医科大学附属第一医院,华中科技大学同济医学院附属同济医院,北京大学第一医院,四川省人民医院,北京医院,上海交大医学院附属瑞金医院
2013-10-29,CTR20130962,支气管炎,,哈尔滨医科大学附属第二医院
2013-10-29,CTR20130963,对头孢地尼敏感的葡萄球菌属、链球菌属、肺炎球菌、消化链球菌、丙酸杆菌、淋菌、伯雷汉氏菌、大肠杆菌、克雷白氏杆菌属、奇异变形杆菌、普罗维登斯菌属、流感杆菌等菌株所引起的下列感染：毛囊炎、疖、疖肿、痈、传染性脓痂疹、丹毒、蜂窝组织炎、淋巴管炎、炭疽、化脓性甲沟炎、皮下脓肿、汗腺炎、粉瘤感染、慢性脓皮症。乳腺炎、肛门周围脓肿、外伤和手术刀口浅存性继发感染。咽喉炎、急性支气管炎、扁桃腺炎症、肺炎。肾盂肾炎、膀胱炎、淋菌性尿道炎。附件炎、宫内感染、前庭大腺炎。眼睑炎、麦粒肿、睑板腺炎。中耳炎、副鼻窦炎。,,航天中心医院
2013-10-29,CTR20130966,对头孢地尼敏感的葡萄球菌属、链球菌属、肺炎球菌、消化链球菌、丙酸杆菌、淋菌、伯雷汉氏菌、大肠杆菌、克雷白氏杆菌属、奇异变形杆菌、普罗维登斯菌属、流感杆菌等菌株所引起的下列感染：毛囊炎、疖、疖肿、痈、传染性脓痂疹、丹毒、蜂窝组织炎、淋巴管炎、炭疽、化脓性甲沟炎、皮下脓肿、汗腺炎、粉瘤感染、慢性脓皮症。乳腺炎、肛门周围脓肿、外伤和手术刀口浅存性继发感染。咽喉炎、急性支气管炎、扁桃腺炎症、肺炎。肾盂肾炎、膀胱炎、淋菌性尿道炎。附件炎、宫内感染、前庭大腺炎。眼睑炎、麦粒肿、睑板腺炎。中耳炎、副鼻窦炎。,,航天中心医院
