2014-09-23,CTR20131473,特发性肺纤维化,中国医学科学院北京协和医院,中国医学科学院北京协和医院,北京大学人民医院,南昌大学第一附属医院,四川大学华西医院,中南大学湘雅医院,第四军医大学第一附属医院（西京医院）,上海市肺科医院,沈阳军区总医院,复旦大学附属中山医院,首都医科大学附属北京友谊医院,宁夏医科大学总医院,Royal Prince Alfred Hospital,Repatriation General Hospital,Alfred Hospital,Frankston Hospital,Prof. Wim Wuyts,Cliniques universitaires de Mont-Godinne,Hopital Universitaire Erasme,UZ Brussel,Diagnostics Research Group,Lynchburg Pulmonary Associates,Pulmonary Associates Clinical Trials,"Oregon Clinic, PC","Minnesota Lung Center, Ltd","Western Connecticut Medical Group, PC",UCLA David Geffen School of Medicine,Baptist Pulmonary and Critical Care Associates,Jamaica Hospital Medical Center,ID Clinical Research Ltd,"Jasper Summit Research, LLC",Cardiopulmonary Associates,Inova Fairfax Hospital,Georgia Clinical Research,FDC Seifer PLC Pulmonary,Pulmonary Associates of Stamford,DCOL Center for Clinical Research,Metroplex Pulmonary and Sleep Center,New York Presbyterian Hospital,"Via Christi Clinic, PA",Medical University of South Carolina,Sansum Clinic,Dartmouth-Hitchcock Medical Center,University of Cincinnati Medical Center,David Geffen School of Medicine at University of California,"The University of California, San Francisco",Rhode Island Hospital,University of Pittsburgh School of Medicine,Vanderbilt University Medical Center,Vermont Lung Center at the University of Vermont,Stanford University Medical Center,Cleveland Clinic Florida,University of Chicago,Hospital of the University of Pennsylvania,Pulmonary and Critical Care Associates,UT Southwestern Medical Center,University of Wisconsin Hospital and Clinics,St. Joseph's Healthcare,QE II Health Sciences Centre,Universitaetsklinikum Essen,Universitaetsklinikum Freiburg,Pneumologisches Forschunginstitut,Universitaetsklinikum der Johannes Gutenberg,Klinikum Donaustauf,Universitaetsklinikum Giessen und Marburg GmbH,Universitaetsklinikum Heidelberg,Lungenaerztliche Gemeinschaftspraxis,HELIOS-Kliniken Emil von Behring,Fachkrankenhaus Coswig GmbH,Klinikum Grosshadern der LMU Muenchen,Universitaetsmedizin Greifswald,Lungenfachklinik Immenhausen,Evangelische Lungenklinik Berlin,Universitaetsklinikum Muenster,Hospital Vall d′Hebron,Hospital Clinic i Provincial de Barcelona,Ciutat Sanitaria Universitaria de Bellvitge,Hospital Nuestra Seneora de Valme,Hospital Bichat,Hospital Avicenne,Hospital Pasteur,CHRU Pontchaillou,Hospital Tenon,Hospital Europeen Georges Pompidou,Hospital Maison Blanche,Hospital Arnaud de Villeneuve,Hospital Albert Calmette,Hospital du Bocage,Hospital Louis Pradel,Hospital Larrey,Hospital Nord,University Hospital of Heraklion,University Hospital of Larisa,Athens Hospital of Chest Diseases,"National Allergy Asthma Bronchitis Institute, Kolkata",SMS Medical College and HospitaL,Mehta Hospital & Cardiopulmonary Care Centre,Chest & Maternity Center,Jehangir Clinical Development Centre Pvt Ltd,Asthma Bhawan,University di Modena e Reggio Emilia,Università di Modena e Reggio Emilia,Università degli Studi di Padova,P.O. Clinicizzato,Ospedale San Giuseppe Fatebenefratelli,Azienda Ospedaliera Universitaria Pisana,Azienda Ospedaliera Universitaria Pisana,Nuovo Ospedale,UO Pneumologia interventistica,Azienda Ospedaliera Universitaria Senese Le Scotte,Policlinico Universitario Tor Vergata,Università Federico II,National University Corporation Tohoku University Tohoku Uni,"Jichi Medical University Hospital,",National Hospital Organization Ibarakihigashi National Hospi,"Saitama Cardiovascular and Respiratory Center,","Tokyo Medical and Dental University,","Nippon Medical School Hospital,","Fukujuji Hospital,","National Center for Global Health and Medicine,","The Jikei University Hospital,","JR Tokyo General Hospital,","Toho University Omori Medical Center,","Kanagawa Cardiovascular and Respiratory Center,","Toranomon Hospital,","Tokyo Medical University Hospital,","Tosei General Hospital,","Nagoya University Hospital,","Ogaki Municipal Hospital,","Tenri Hospital,",National Hospital Organization Kinki-Chuo Chest Medical Cent,"Kinki University Hospital,","National Hospital Organization Himeji Medical Center,",Kobe City Hospital Organization Kobe City Medical Center Gen,"Tottori University Hospital,","Tokushima University Hospital,","Toranomon Hospital Kajigaya,",St. Antonius Ziekenhuis,Onze Lieve Vrouwe Gasthuis,Erasmus Medisch Centrum,Centro Hospitalar S？o Jo？o,Centro Hospitalar Lisboa Central,Cento Hospitalar Lisboa Norte,"Centro Hospitalar e Universitário de Coimbra, EPE",Centro Hospitalar de Vila Nova de Gaia/Espinho,Instituto Nacional de Enfermedades Respiratorias,Instituto Nacional del Torax,Asan Medical Center,Soon Chun Hyang University Hospital Bucheon,Seoul National University Hospital,Gachon University Gil Medical Center,Soon Chun Hyang University Hospital Seoul,"The Catholic University of Korea, Yeouido ST.Mary's Hospital",Masaryk Hospital,University Hospital Na Bulovce,Thomayer's Hospital,Rabin Medical Center,Kaplan Medical Center,Scientific Research Institute of Pulmonology,"Mehilainen Kielotie, Vantaa",HYKS Keuhkosairauksien tutkimusyksikk？,Istanbul Universitesi Cerrahpasa Tip Fakultesi,Nesrin Mogulkoc,Ankara üniversitesi G？güs Hastaliklari Anabilimdali,Dr. Suat Seren Gogus Hastaliklari ve Gogus Cerrahisi Hast.,Yedikule Gogus Hastaliklari ve Gogus Cer Egitim ve Aras Has,North Bristol NHS Trust,Royal Brompton & Harefield NHS Foundation Trust,Lung Investigation Unit,Aintree University Hospitals NHS Foundation Trust,Heart of England NHS Foundation Trust,NHS Grampian,Oxford Radcliffe Hospitals NHS Trust,Leeds Teaching Hospitals NHS Trust,Mater Misericordiae University Hospital Ltd,HYKS Keuhkosairauksien,Cukurova Tip Fakultesi Balcali Hastanesi,North Bristol NHS Trust Southmead Hospital,Royal Brompton Hospital,University Hospitals Birmingham NHS Foundation Trust Queen Elizabeth Hospital,Aintree University Hospitals NHS Foundation Trust Aintree University Hospital,Birmingham Heartlands Hospital,NHS Grampian Aberdeen Royal Infirmary,Leeds Teaching Hospitals NHS Trust St James's University Hospital,"Oxford University Hospitals NHS Foundation Trust Churchill Hospital, Oxford Respiratory Trials Unit"
2014-09-10,CTR20131476,特发性肺纤维化,中国医学科学院北京协和医院,中国医学科学院北京协和医院,北京大学人民医院,南昌大学第一附属医院,四川大学华西医院,中南大学湘雅医院,第四军医大学第一附属医院（西京医院）,Royal Prince Alfred Hospital,Repatriation General Hospital,Repatriation General Hospital,Alfred Hospital,Frankston Hospital,UZ Leuven,Cliniques universitaires UCL de Mont-Godinne,Hopital Universitaire Erasme,UZ Brussel - Campus Jette,Loess Hill Research Center,Allegheny General Hospital / Allegheny Singer Research Insti,Lynchburg Pulmonary Associates,University of Cincinnati Medical Center,"David Geffen School of Medicine at University of California, Los Angeles",University of Alabama,Rhode Island Hospital,University of Texas Southwestern Medical Center at Dallas,Pulmonary Associates Clinical Trials,Vanderbilt University Medical Center,"Minnesota Lung Center, Ltd",Metroplex Pulmonary & Sleep Center,New York Presbyterian Hospital,"Oregon Clinic, PC",Inova Fairfax Hospital,Western Connecticut Medical Group P.C.,Cleveland Clinic Florida,University of Medicine & Dentistry of New Jersey,"Lung Health and Sleep Enhancement Center, LLC","Via Christi Clinic, PA","Jasper Summit Research, LLC",University of Pittsburgh School of Medicine,FDC Seifer PLC Pulmonary,MultiCare Pulmonary Specialists,Universitatsklinikum Essen,Pneumologisches Forschunginstitut,Universitatsklinikum der Johannes Gutenberg,Klinikum Donaustauf,Universitatsklinikum Giessen und Marburg GmbH,Universitatsklinikum Heidelberg,Lungenarztliche Gemeinschaftspraxis,Hospital Bichat,Hospital Avicenne,Hospital Pasteur,Hospital Pontchaillou,Hospital Tenon,Hospital europern Georges Pompidou,CHU Hospital Maison blanche,P. D. Hinduja National Hospital & Research Center,PSG Hospitals,Qualysure clinical Research Solution,"National Allergy Asthma Bronchitis Institute, Kolkata",SMS Medical College and HospitaL,Università di Modena e Reggio Emilia,Università degli Studi di Padova,P.O. Clinicizzato,Ospedale San Giuseppe Fatebenefratelli,Azienda Ospedaliera Universitaria Pisana,Azienda Ospedaliera Universitaria Pisana,Nuovo Ospedale,UO Pneumologia interventistica,Azienda Ospedaliera Universitaria Senese Le Scotte,Policlinico Universitario Tor Vergata,Alessandro Sanduzzi Zamparelli,Dip. Medicina interna e Specialistica Sez. Mal. Respiratorie,National University Corporation Tohoku University,Jichi Medical University Hospital,National Hospital Organization,Saitama Cardiovascular and Respiratory Center,Tokyo Medical and Dental University,Nippon Medical School Hospital,Fukujuji Hospital,National Center for Global Health and Medicine,The Jikei University Hospital,JR Tokyo General Hospital,Toho University Omori Medical Center,Kanagawa Cardiovascular and Respiratory Center,Masaryk Hospital,University Hospital Na Bulovce,Thomayer's Hospital,Rabin Medical Center,Kaplan Medical Center,Rambam Health Care Campus,North Bristol NHS Trust,Royal Brompton & Harefield NHS Foundation Trust,University Hospital Birmingham NHS Foundation Trust,Aintree University Hospitals NHS Foundation Trust,Heart of England NHS Foundation Trust,NHS Grampian,Oxford Radcliffe Hospitals NHS Trust,St James University Hospital,Mater Misericordiae University Hospital Ltd,Joachim Muller-Quernheim
2014-09-01,CTR20131477,特发性肺纤维化,中国医科大学附属第一医院,中国医科大学附属第一医院,上海市肺科医院,沈阳军区总医院,复旦大学附属中山医院,上海市交通大学医学院附属瑞金医院,首都医科大学附属北京友谊医院,宁夏医科大学总医院,复旦大学附属华东医院,Diagnostics Research Group,Temple Lung Center Ambulatory Care Center,Dartmouth Hitchcock Medical Center,Cardiopulmonary Associates,Consultants in Pulmonary Medicine,"Oregon Clinic, PC",University of Wisconsin,Duke University Medical Center,University of Chicago,Stanford Medical Center Pulmonary & Critical Care Clinic,Arizona Pulmonary Specialists,Mayo Clinic College of Medicine,Pulmonary Associates of Stamford,Medical University of South Carolina,Penninsula Pulmonary Medical Associates,University of Utah Health Care Systems,Pulmonary and Critical Care Associates,University of California at San Francisco,Miami Research Associates,ID Clinical Research Ltd,Hospital of the University of Pennsylvania,Baptist Pulmonary & Critical Care Associates,Jamaica Hospital Medical Center,Sansum Clinic,DCOL Center for Clinical Research,Georgia Clinical Research,Vermont Lung Center,Respiratory Research,St. Joseph's Healthcare,QE II Health Sciences Centre,Universitatsklinikum Essen,HELIOS-Kliniken Emil von Behring,Zentralklinik Bad Berka GmbH,Universitaetsklinikum Muenster,Fachkrankenhaus Coswig GmbH,Klinikum Grosshadern der LMU Muenchen,Universitaetsmedizin Greifswald,Lungenfachklinik Immenhausen,Evangelische Lungenklinik Berlin,Kliniken der Stadt Koeln gGmbH,Nou Hospital de Sant Pau,Hospital Vall d'Hebron,Hospital Clinic i Provincial de Barcelona,Ciutat Sanitaria Universitaria de Bellvitge,Hospital Virgen de Valme,Hospital Universitario de la Princesa,Hospital Arnaud de Villeneuve,Hospital Albert Calmette,CHU de Dijon - Bocage Central,Hospital Louis Pradel,Hospital Larrey,Hospital Nord,University Hospital of Heraklion,General Hospital,General Hospital of Nikaia,University Hospital of Larisa,Athens Hospital of Chest Diseases,Mehta Hospital & Cardiopulmonary Care Centre,Chest and Maternity Centre,K.E.M Hospital,Jahingir Clinical Development Centre,Asthma Bhawan,Toranomon Hospital,Tokyo Medical University Hospital,Tosei General Hospital,Nagoya University Hospital,Ogaki Municipal Hospital,Tenri Hospital,National Hospital Organization Kinki-Chuo,Kinki University Hospital,National Hospital Organization Himeji Medical Center,Kobe City Medical Center General Hospital,Tottori University Hospital,Tokushima University Hospital,Toranomon Hospital Kajigaya,Antonius Ziekenhuis,Onze Lieve Vrouwe Gasthuis,Erasmus Medisch Centrum,"Hospital de Sao Joao, EPE",Centro Hospitalar Lisboa Central,"CHLN, EPE - Hospital Pulido Valente",Centro Hospitalar de Coimbra,Centro Hospitalar de Vila Nova de Gaia/Espinho,Hospital Fernando Fonseca,Instituto Nacional de Enfermedades Respiratorias,Instituto Nacional del Torax,Asan Medical Center,Soon Chun Hyang University Hospital Bucheon,Seoul National University Hospital,Gachon University Gil Hospital,Soon Chun Hyang University Hospital Seoul,"The Catholic University of Korea, Yeouido St.Mary's Hospital",Kazan State Medical University GOU VPO,Scientific Research Inst. of Pulmonology Pavlov State Med.,HYKS Keuhkosairauksien tutkimusyksikko,Istanbul Universitesi Cerrahpasa Tip Fakultesi,Ege Universitesi Tip Fakultesi Gogus Hastaliklari A.B.D.,Ankara Universitesi Goegues Hastaliklari Anabilimdali,Dr. Suat Seren Gogus Hastaliklari ve Gogus Cerrahisi Hast.,Yedikule Gogus Hastaliklari Hastanesi
2014-09-16,CTR20131478,慢性阻塞肺病,广州医学院附属第一医院,广州医学院第一附属医院呼吸研究所,上海东方医院,北京朝阳医院,解放军总医院第一附属医院（304医院）,上海肺科医院,复旦大学附属华东医院,瑞金医院,苏北人民医院,中国医科大学附属第一医院,西安交通大学医学院第二附属医院,中南大学湘雅医院,湖南省人民医院,佛山市第一人民医院,广西医科大学第一附属医院,华中科技大学同济医学院附属协和医院,宁夏医科大学附属医院,Clinical Trials Centre,The Queen Elizabeth Hospital,Royal Adelaide Hospital,Frankston Hospital,NZ Respiratory and Sleep Institute,RMC Medical Research Ltd,Morgantown Pulmonary Clinical Research,Diagnostics Research Group,St. Francis Sleep and Lung Allergy Institute,LSUHSC- General Internal Medicine,"Clinical Partners LLC, Johnston","Bernstein Clinical Research Center LLC, Cincinnati","Pulmonary & Research Associates, Spokane","AAIR Research Center, Rochester","COR Clinical Research LLC, Oklahoma City","Clinical Research of West Florida, Clearwater","Gaffney Pharmaceutical Research, Gaffney","Pulmonary Research Institute of Southeast Michigan, Livonia","Spartanburg Medical Research, Spartanburg","SMMC/Primary Physicians Services, Biddeford",Boulder Medical Center PC,"Quality Clinical Research Inc, Omaha",Tabor City Family Medicine,"Palmetto Medical Research Associates, Easley","North Carolina Clinical Research, Raleigh","Rocky Mountain Center for Clinical Research, Wheat Ridge","Pulmonary Research Associates LLC,","Lynchburg Pulmonary Associates Inc, Lynchburg","Emerald Isle Pulmonary, Panama City","Pulmonary Disease & Critical Care Associates PA, Columbia","North Texas Lung & Sleep Clinic, Ft. Worth","Southern Illinois Clinical Research Centre, O'Fallon","National Allergy, Asthma & Urticaria Centers, Charleston","Multi Care Pulmonary Specialists, Tacoma","Pulmonary Associates of Stamford, Stamford","Community Medical Research, LLC, Opelousas","Pulmonary Associates of Mobile, P.C., Mobile","ID Clinical Research LTD, Toledo","Jasper Summit Research LLLC, Jasper","Midwest Pulmonary Sleep & Research, Centerville","Remington Davis, Inc, Columbus",Dr. Tharwat Fera,University of Calgary,CRAAQ,"Concordia Hospital, Respiratory Research",Dr. W. Patrick Killorn Medicine Professional Corporation,Clinique Médicale St-Louis,West Lincoln Memorial Hospital,CHUS - Hopital Fleurimont,Dr. A. Nayar Medical Professional Corporation,Allergy and Asthma Research Centre,"Bispebjerg Hospital, Lungemedicinsk afd.","Aalborg Sygehus, Lungemedicinsk Forskningsafd.","Regionshospitalet Silkeborg, Medicinsk afd","GP, Sorensen, Vrlse","Sygehus Sonderjylland, Medicinsk afd","Odense Universitetshospital, Lungemedicinsk Forskningsenhed","Kolding Sygehus, Hjertemedicinsk Amb.","Roskilde Sygehus, Lungemedicinsk afd.","Hvidovre Hospital, Hjerte-Lungemedicinsk afd.","Notved Sygehus, Medicinsk afd","IFG - Institut für Gesundheitsfrderung, Dr.Beck, Rüdersdorf","Klinische Forschung Berlin Mitte, Berlin","Praxis Dr. Eller, Berlin","Praxis Dr. Hofbauer, Weinheim","Klinische Forschung Hamburg, 20253 Hamburg",CIMS Studienzentrum Bamberg Unternehmergesellschaft,"Praxis Dr. Kupfer, Mühlhausen","Pneumologisches Zentrum Wiesloch, Dr. Redlich","KPPK GmbH, Studienzentrum, Koblenz",Medizinisches Versorgungszentrum Hamburg,"Praxis Dr. Trümper, Erfurt","Praxis Dr. Venske, Oschersleben","Klinische Forschung Berlin-Buch GmbH, Berlin","Institut für Klilnische Forschung, Neu-Isenburg",Universitarklinikum Mainz,"HOP Sud Reunion, Mal Inf, Saint Pierre","HOP Civil, explor physio, Strasbourg","HOP Germon et Gauthier, Pneumo, Béthune","CTR Erdre St Augustin,Pneumo, Nantes","HOP Caremeau, Pneumo, Nmes","HOP A.Villeneuve, Pneumo, Montpellier","CAB Verdier S, Pneumologie, Perpigan",SMS Medical College and HospitaL,Chest & Maternity Center,Kovai Medical Center& Hospital,Chest Research Foundation,St. Johns Medical College and Hospital,Asthma Bhawan,Allergy Asthama Associates,Dr. Bhagat's Allergy Clinic,Kamineni Hospital,Ospedale Cisanello - Dip.to Cardio Toracico - PISA,A.O. Ospedale San Martino-Fisiopatol. Respiratoria- Genova,Ospedale Rasori - Clinica Pneumologica - Parma,Fondazione S. Maugeri-Clinica del Lavoro e Riabilitazione,Div. Pneumologia e Tisiologia IV-P. O. R. Binaghi-Cagliari,Nuovo Ospedale,"Asahikawa Med. Ctr, Hokkaido, Resp. Med.","Iwate Med. Univ. Hp., Iwate, RESP&ALLE&con. tissue dis. med.","Tohoku Univ. Hp., Miyagi, Dep. of Resp. Med.","Ibarakihigashi Nat. Hp., Ibaraki, Dep. of Resr. Med.","Kameda Clinic, Chiba, Dep. of PULM Med.","Juntendo Univ., Tokyo, RESR Med.","Tokyo Med. Univ. Hp., Tokyo, Dep. of RESP Med., RESP Ctr","Nihon Univ. Itabashi Hp., Tokyo, Resr. Med","Tosei Gen. Hp., Aichi, Dep. of Allergy & Resr. Med.","Matsusaka City Hp., Mie, Resp. Med.","Kishiwada City Hp., Osaka, Resr. Med.","Kinki Univ Hp., Osaka, RESR Med. & ALLE","Wakayama Med. Univ., Wakayama, Dep. of Allergy & RESR Med.","Himeji Med. Ctr, Hyogo, RESR Tract Med.","Kurume Univ. Hp, Fukuoka, RESR, NEURO, Collagenosis and I.M.","Fukuoka Univ., Fukuoka, RESR Med.","Harasanshin Hp., Fukuoka, Dep. of Resr. Med.","Kirigaoka Tsuda Hp., Fukuoka, I.M.","Kumamoto Saishunso Nat. Hp., Kumamoto, Resp. Med.","Kamoike Seikyo Clinic, Kagoshima, RESP Med.","Kagoshima Univ Med&Dent. Hp, Kagoshima, RESP&Stress Care Ctr","Karimata Med. Clinic, Okinawa, I.M.","Nakamura Clinic, Okinawa, I.M.","Tokyo Med. Univ. Ibaraki Med. Ctr, Ibaraki, RESP Med.","Saiseikai Kurihashi Hp., Saitama, Resp. Med.","Sakayori Clinic, Tokyo, Resp. Med.","Koto Hp., Tokyo, Dep. of Resp. Med.","Kanagawa CV & RESR Ctr, Kanagawa, Resr. Med.","Shinshu Univ., Nagano, RESP & Infectious Disease","Matsumoto Med. Ctr, Nagano, Dep. of RESR Med.","Tenryu National Hp., Shizuoka, RESP and ALLE","Komaki City Hp., Aichi, Dep. of Resp. Med. & ALLE","Hiramatsu Int. & Resp. Med. Clinic, Aichi, Resp. Med.","Chubu Rosai Hp., Aichi, Resr. Med.","Gifu Pref. Gen. Med. Ctr, Gifu, Resp. Med.","Daido Hp., Aichi, Resp. Med.","Nara Hp., Kinki Univ. Faculty of Med, Nara, RESP & ALLE Med.","Kure Kyosai Hp., Hiroshima, Resp. Med.","Takamatsu Municipal Hp., Kagawa, Resp. Med.","KKR Takamatsu Hp., Kagawa, I.M.","Fukuoka Nat. Hp., Fukuoka, Dep. of RESP Disease","Fukuoka-Higashi National Hp., Fukuoka, RESR Med.","Nagata Hp., Fukuoka, Resp. Med.","Kuwamizu Hp., Kumamoto, I.M.","Tohoku Rosai Hp., Miyagi, RESP Tract Med.",Catharina Ziekenhuis,"Maxima Medisch Centrum, locatie Veldhoven",Gelre Ziekenhuis Zutphen,ZGT Almelo,"St. Antonius ziekenhuis, locatie Nieuwegein",Amphia Ziekenhuis locatie Molengracht,"Atrium Medisch Centrum Parkstad, Locatie Heerlen",Ziekenhuis St Jansdal,Westfriesgasthuis,ZGT Hengelo,"CHUC, EPE - Centro Hospitalar Coimbra, Pneumology Dep.","CHLC, EPE - Hospital de Santa Marta, Pneumology Dep","Centro Hospitalar So Joo, EPE, Pneumology Dep.","CHLN, EPE - Hospital Pulido Valente, Pneumology II Dep.","Hospital Fernando Fonseca, EPE, Pneumology Dep.","Centro Hospitalar de Vila Nova Gaia/Espinho, Pneumology Dep.","Hospital de Sao Teotónio, Pneumology Dep.",WM Investigaciones Clinicas SA,Centro de Investigación Clinica Belgrano,Investigaciones en Patologias Respiratorias,Sanatorio Parque,Instituto de Investigaciones Clinicas Mar del Plata,Instituto Ave Pulmo,Centro Respiratorio de Quilmes,INSARES,Centro de Investigaciones Medicas,Centro Modelo de Cardiologia,Clínica Privada de Monte Grande,OMI - Organizacion Medica de Investigacion,CEDIC - Centro de Investigacion Clinica,Consultorio Dr Francisco Flores,Consultorio Dr Gerardo Martinez,Consultorio Dr Jeremias Guerra,Consultorio Dr Erick Yoc,Consultorio Dr Edgar Contreras,Consultorio Dr Esau Espana,Consultorio Dr Juan Pablo Moralejo,Hospital Angeles Tijuana,Hospital General del Estado de Sonora Ramos Bours,Centro Respiratorio de Mexico,Hospital Universitario Dr Jose Eleuterio Gonzalez,"The Catholic University of Korea, St.Paul's Hospital",Konkuk University Hospital,Korea University Guro Hospital,Soon Chun Hyang University Bucheon Hospital,Ajou University Hospital,"Yonsei University, Wonju Christian Hospital",Severance Hospital,Yeungnam University Medical Center,"Regional Hospital for Pulmonary Diseases, Rousse",Medical Centre for Pneumo-Phthisiatric Diseases,Specialized hosp. f. active treatment of pulmonary diseases,MHAT,St. George Med. Center Outpatient consult.f.Pulmonary diseas,Special. hosp. f. active treat. of pulmon. phthysiat. diseas,Multiprofil Reg. Hosp.f.active treat. Dr.Stephan Tcherkezov,"Ordinace Respiracnich nemoci, Jirmanova, Praha 17","Lecebna respiracnich nemoci, Dr. Hadrava, Cvikov","TRN, s.r.o.","Office of TBC and Respiratory Diseases, Beroun","Plicni ambulance Rokycany, 33722 Rokycany",Tartu University Hospital,"North Estonia Medical Centre Foundation, Tallin",Csongrad County's Hospital of Chest Diseases,Pulmonology Institute of Trkbalint,"Markusovszky County Hospital, Szombathely","Egeszsegügyi Jarobeteg Kzpont Nonprofit Kft.,Pulm Institute",Sandor Lumniczer Hospital and Outpatient Clinic,"MUZ Gatchinskaya Central Regional Clinical Hospital,Gatchina",Scientific Research Institute of Pulmonology,Kazan State Medical University GOU VPO,Central Clin. Hosp.1,"Clinical Hospital No. 23, Moscow",Hospital Golnik,Hospital Golnik,HYKS Keuhkosairauksien tutkimusyksikk,"Terveystalo Pulssi, Turku","Satakunnan keskussairaala, Keuhkopoliklinikka",MERSIN UNIVERSITESI TIP FAKULTESI GOGUS HASTALIKLARI A.B.D.,Dr. Suat Seren Gogus Has ve Gogus Cerrahisi Egit ve Aras Has,Yedikule Gogus Hastaliklari ve Gogus Cer Egitim ve Aras Has,Dr. Lütfi Kirdar Egitim ve Arastirma Hastanesi,Kocaeli Universitesi Tip Fakultesi,Clinical Trials Centre,The Queen Elizabeth Hospital,Frankston Hospital
