首次公示信息日期,登记号,适应症,主要研究者信息
2014-01-15,CTR20130009,高胆固醇血症和家族性高胆固醇血症,天津中医药大学第二附属医院,天津中医药大学第二附属医院,天津中医药大学第二附属医院
2014-06-03,CTR20130001,围术期治疗和预防血容量不足,北京大学第一医院,北京大学附属第一医院,中国医科大学附属第一医院,第二军医大学长海医院,上海交通大学医学院附属仁济医院,复旦大学附属中山医院,第二军医大学长海医院,中国医科大学附属第一医院,复旦大学附属中山医院,上海交通大学医学院附属仁济医院
2014-05-08,CTR20130013,补铁，用于治疗缺铁性贫血儿童患者，对其它口服形式的铁制剂不能耐受的孕妇，以及类风湿性关节炎引起的贫血。,首都医科大学附属北京儿童医院,首都医科大学附属北京儿童医院,首都儿科研究所附属儿童医院,上海市儿童医院,山东大学齐鲁医院,重庆医科大学附属儿童医院,浙江大学医学院附属儿童医院,山西省儿童医院 山西省妇幼保健院,海南省第三人民医院,江苏省中医院,天津中医药大学第一附属医院
2014-03-31,CTR20130010,慢性非细菌性前列腺炎,上海中医药大学附属曙光医院,上海中医药大学附属曙光医院
2018-03-12,CTR20130012,适用于绝经后激素受体阳性的早期乳腺癌患者的辅助治疗。适用于绝经后激素受体阳性或受体状态未知的局部晚期乳腺癌或转移性乳腺癌患者的一线治疗。适用于既往行他莫昔芬治疗的绝经后晚期乳腺癌患者的治疗。雌激素受体阴性的患者和前期他莫昔芬治疗无缓解的患者，服用阿那曲唑，较少有缓解。,益阳市中心医院,益阳市中心医院
2016-01-20,CTR20130002,动脉粥样硬化,北京大学第一医院,北京大学第一医院,中国人民解放军第二五四医院,苏州大学附属第一医院,上海市同济医院,首都医科大学附属北京世纪坛医院,东南大学附属中大医院,上海市浦东新区东方医院,天津市人民医院,华中科技大学同济医学院附属协和医院,浙江医院,中国人民解放军北京军区总医院,泰达国际心血管病医院,浙江大学医学院附属邵逸夫医院,北京协和医院,上海市胸科医院,河北医科大学第二医院,吉林大学中日联谊医院,福建医科大学附属第一医院,首都医科大学附属北京安贞医院,重庆医科大学附属第二医院,武汉大学人民医院,广州中医药大学附属第一医院,首都医科大学附属北京同仁医院,复旦大学附属中山医院,广西壮族自治区人民医院,广州市红十字会医院,包头市中心医院,哈尔滨医科大学附属第一医院,北京中日友好医院,中南大学湘雅三医院,西安交通大学医学院第一附属医院,中国医科大学附属盛京医院,上海市第一人民医院,辽宁省人民医院,广东省人民医院,西安交通大学医学院第二附属医院,上海市徐汇区中心医院,上海交通大学医学院附属瑞金医院,大连医科大学附属第一医院,中国人民解放军总医院,Hardas Heart Care,上海市同济医院,首都医科大学附属北京世纪坛医院,东南大学附属中大医院,上海市浦东新区东方医院,天津市人民医院,华中科技大学同济医学院附属协和医院,浙江医院,中国人民解放军北京军区总医院,泰达国际心血管病医院,上海市徐汇区中心医院,上海交通大学医学院附属瑞金医院,浙江大学医学院附属邵逸夫医院,北京协和医院,中国人民解放军总医院,上海市胸科医院,河北医科大学第二医院,吉林大学中日联谊医院,福建医科大学附属第一医院,首都医科大学附属北京安贞医院,大连医科大学附属第一医院,重庆医科大学附属第二医院,武汉大学人民医院,广州中医药大学附属第一医院,首都医科大学附属北京同仁医院,复旦大学附属中山医院,广西壮族自治区人民医院,广州市红十字会医院,北京大学第一医院,哈尔滨医科大学附属第一医院,北京中日友好医院,中南大学湘雅三医院,西安交通大学医学院第一附属医院,中国医科大学附属盛京医院,上海市第一人民医院,辽宁省人民医院,广东省人民医院,中国人民解放军第二五四医院,苏州大学附属第一医院,包头市中心医院,西安交通大学医学院第二附属医院
2018-09-21,CTR20130021,对绝经后早期乳腺癌患者的辅助治疗，此类患者雌激素或孕激素受体阳性。对已经接受他莫昔芬辅助治疗5年的、绝经后早期乳腺癌患者的辅助治疗，此类患者雌激素或孕激素受体阳性。治疗绝经后、雌激素受体阳性、孕激素受体阳性或受体状况不明的晚期乳腺癌患者，这些患者应为自然绝经或人工诱导绝经。,四川大学华西第二医院,四川大学华西第二医院
2014-03-14,CTR20130017,急性上呼吸道感染,第三军医大学大坪医院,第三军医大学大坪医院,甘肃省人民医院,中国人民解放军成都军区总医院,内蒙古医学院附属医院,天津中医药大学第一附属医院
2015-02-28,CTR20130022,部分性癫痫,复旦大学附属华山医院,复旦大学附属华山医院,四川省人民医院,昆明医学院第一附属医院,四川大学华西医院,重庆医科大学附属第一医院,广州医学院第一附属医院,广州医学院第二附属医院,广东省人民医院,哈尔滨医科大学附属第一医院,江西省人民医院,南昌大学第二附属医院,中山大学附属第一医院,浙江医科大学附属邵逸夫医院,吉林大学白求恩第一医院,中山大学附属第三医院,第四军医大学西京医院,武汉大学中南医院,山东大学齐鲁医院,河北医科大学第二附属医院,赵合庆中国医科大学附属第一医院,苏州大学附属第二医院,上海长征医院,华中科技大学同济医学院附属协和医院,上海交通大学附属瑞金医院,中国人民解放军北京军区总医院,温州医学院附属第一医院,东南大学附属中大医院,厦门大学附属中山医院,大连医科大学附属第二医院,中国海洋大学附属青岛市市立医院,山西医科大学第一附属医院,第四军医大学西京医院,中山大学附属第三医院,吉林大学白求恩第一医院,浙江医科大学附属邵逸夫医院,中山大学附属第一医院,南昌大学第二附属医院,江西省人民医院,哈尔滨医科大学附属第一医院,山东大学齐鲁医院,上海长征医院,苏州大学附属第二医院,中国医科大学附属第一医院,广东省人民医院,广州医学院第二附属医院,广州医学院第一附属医院,重庆医科大学附属第一医院,四川大学华西医院,昆明医学院第一附属医院,中国海洋大学附属青岛市市立医院,山西医科大学第一附属医院,河北医科大学第二附属医院,武汉大学中南医院,四川省人民医院,大连医科大学附属第二医院,厦门大学附属中山医院,东南大学附属中大医院,温州医学院附属第一医院,华中科技大学同济医学院附属协和医院,上海交通大学附属瑞金医院,中国人民解放军北京军区总医院
2013-01-24,CTR20130023,原发性高胆固醇血症患者，包括家族性高胆固醇血症（杂合子型）或混合性高脂血症（相当于Fredrickson分类法的IIa和IIb型）的患者，如果饮食治疗和其它非药物治疗疗效不满意，应用本品可治疗其总胆固醇升高、低密度脂蛋白胆固醇升高、载脂蛋白B升高和甘油三酯升高。,,苏州大学第二附属医院
2018-03-12,CTR20130024,用于治疗内源性生长激素缺乏所致的儿童生长缓慢,中山大学附属第一医院临床药理研究所,中山大学临床药理研究所,中国人民解放军军事医学科学院微生物流行病研究所,中山大学附属第一医院
2015-02-26,CTR20130028,II 型糖尿病（T2DM）,中日友好医院,中日友好医院,中国人民解放军总医院,首都医科大学附属北京同仁医院,中国人民解放军北京军区总医院,中国人民解放军第二炮兵总医院,上海市第十人民医院,天津医科大学总医院,河北医科大学第三医院,苏州大学附属第二医院,中国人民解放军第四军医大学第一附属医院,西安交通大学医学院第一附属医院,四川省人民医院,四川大学华西医院,吉林大学第二医院,哈尔滨医科大学附属第二医院,青岛大学医学院附属医院,南京大学医学院附属鼓楼医院,南京医科大学第二附属医院,南方医科大学南方医院,海南省人民医院,中南大学湘雅二医院,山东大学齐鲁医院,华中科技大学同济医学院附属同济医院,上海长征医院,济南市中心医院,中国医科大学附属盛京医院滑翔分院,北京大学第一医院,大连医科大学第二附属医院,南京军区福州总医院,四平市中心人民医院,Global Hospital Clinical Research Services,"Jehangir Clinical Development Pvt. Ltd., Jehangir Hospital",Manipal Hospital,Getwell Hospital & Research Institute,APOLLO HOSPITALS,"Centre for Diabetes and Endocrinology, Faculty of Medicine, J.N. Medical College & Hospital",AMC MET Medical College and Sheth L.G General Hospital,Department of Endocrinology  Gandhi Medical College,King George Hospital & Andhra Medical College,Mediciti Hospital,Cauvery Medical Center,Wonju Severance christian Hospital,Yeung Nam University Hospital,Inje University Busan Paik Hospital,Inje University Ilsan Paik Hospital,Korea University Anam Hospital,Kyunghee University Hospital,Eulji General Hospital,City Consultative and Diagnostic Centre No.1,Saint-Petersburg State Budgetary Institution of Healthcare  Outpatient clinic No.17,Center Diabetes,Kirov city hospital No.7
2015-02-27,CTR20130026,慢性原发免疫性血小板减少症,中国医学科学院血液病医院,中国医学科学院血液病医院,北京协和医院,山东大学齐鲁医院,四川大学华西医院,苏州大学附属第一医院,广东省人民医院,北京大学人民医院,浙江大学医学院附属第一医院,南方医科大学南方医院,北京大学第三附属医院,南京医科大学第一附属医院（江苏省人民医院）,上海长海医院,福建医科大学附属协和医院,北京大学第一附属医院,中南大学湘雅三医院,南昌大学附属第一医院,上海交通大学医学院附属瑞金医院,北京大学人民医院,南京医科大学第一附属医院（江苏省人民医院）,南方医科大学南方医院,浙江大学医学院附属第一医院,北京大学第一附属医院,广东省人民医院,苏州大学附属第一医院,四川大学华西医院,山东大学齐鲁医院,北京协和医院,上海交通大学医学院附属瑞金医院,北京大学第三附属医院,福建医科大学附属协和医院,上海长海医院
2014-01-16,CTR20130030,用于痛风患者高尿酸血症的长期治疗。,第三军医大学第一附属医院,中国人民解放军第三军医大第一附属医院,上海交通大学医学院附属新华医院,南京医科大学第二附属医院,海南医学院附属医院,上海市第六人民医院,中国人民解放军第三军医大学附属新桥医院,兰州大学第一医院,南昌大学第一附属医院,中国人民解放军沈阳军区总医院,湖北省中医院,辽宁中医药大学附属医院
2013-01-16,CTR20130018,非肌层浸润性膀胱癌,,wei sheng bu beijing yi yuan
2013-02-22,CTR20130033,原发性高胆固醇血症,,浙江大学医学院附属第二医院
2014-03-06,CTR20130046,肺炎，细菌性,复旦大学附属华山医院,复旦大学附属华山医院,内蒙古医科大学附属医院,复旦大学附属华东医院,上海浦东新区东方医院,上海市普陀区中心医院,北京协和医院,首都医科大学附属北京朝阳医院,中国人民武装警察部队总医院,四川大学华西医院,沈阳军区总医院,中南大学湘雅三医院,长沙市中心医院,常德市第一人民医院,山西医科大学第二医院,海南医学院附属医院,浙江大学医学院附属第一医院,海南省人民医院,山西医科大学第一医院,吉林大学第一医院,吉林省人民医院,温州医学院附属第二医院,广西医科大学第一附属医院,厦门大学附属第一医院,河北省人民医院,青岛市市立医院,中国人民解放军南京军区福州总医院,上海长征医院,上海市肺科医院,长沙市第三医院,内蒙古医科大学附属医院,河北省人民医院,厦门大学附属第一医院,广西医科大学第一附属医院,温州医学院附属第二医院,吉林省人民医院,吉林大学第一医院,山西医科大学第一医院,海南省人民医院,浙江大学医学院附属第一医院,海南医学院附属医院,山西医科大学第二医院,常德市第一人民医院,长沙市中心医院,中南大学湘雅三医院,沈阳军区总医院,四川大学华西医院,中国人民武装警察部队总医院,首都医科大学附属北京朝阳医院,北京协和医院,上海市普陀区中心医院,上海浦东新区东方医院,复旦大学附属华东医院,上海长征医院,复旦大学附属华山医院,中国人民解放军南京军区福州总医院,青岛市市立医院
2014-04-03,CTR20130034,适用于患有高磷血症正在进行透析治疗的慢性肾脏疾病（CKD）患者,上海长征医院,上海长征医院,上海瑞金医院,江苏省人民医院,东南大学附属中大医院,无锡市人民医院,上海仁济医院,中国医学科学院北京协和医院,北京大学人民医院,浙江大学医学院附属第一医院,华中科技大学同济医学院附属同济医院,常州市第一人民医院
2014-06-03,CTR20130041,中央型非小细胞肺癌伴严重气道阻塞,广州医科大学附属第一医院,广州医科大学附属第一医院,第二军医大学附属长海医院,四川省人民医院,中国人民解放军第三军医大学第一附属医院,中国人民解放军第三军医大学第二附属医院,第四军医大学第二附属医院唐都医院,中南大学湘雅医院,中国人民解放军总医院,中山大学附属肿瘤医院,四川大学华西医院,第四军医大学第附属医院西京医院,上海交通大学附属胸科医院,重庆市肿瘤医院,华中科技大学同济医学院附属同济医院,北京肿瘤医院,上海第一人民医院,同济大学附属肺科医院
2014-05-04,CTR20130038,甲状腺癌,天津市肿瘤医院,天津市肿瘤医院,中山大学肿瘤防治中心,北京协和医院,中国医学科学院肿瘤医院,四川大学华西医院,浙江肿瘤医院,KH Barmherzige Schwestern Abteilung für NuklearmedizinSeilerst？tte 4,AKH - University tskliniken Univ.-Klinik für Innere Medizin IKlinische,Institut Jules Bordet / Jules Bordet Instituut  Service Oncologie / Dienst Oncologie,SHATO Radiotheraphy ClinicPlovdivsko Polande 6,Tsaritsa Yoanna UMHAT Clinic of Radiology,Odense Odense UniversitetshospItalyl,IGR Service de Médecine Nucléaire et Cancérologie Endocrinienne,Institut Bergonie Service de Médecine Nucléaire,Centre Francenois Baclesse Service de Médecine Nucléaire,Centre Léon Bérard Département de Médecine,Oncologie Médicale  Institut Paoli Calmettes,CHU Angers Département d’Endocrinologie Diabète Nutrition4 rue Larrey,Hospitalyl La Pitie-Salpetriere Service D’oncologie,CHRU Lille – HospItalyl Claude Huriez Service d’Endocrinologie,Universit. Erlangen-Nürnberg Nuklearmedizinische Klinik,"Bockisch, Andreas","Klinikum Innenstadt Medizinische Klinik, Endokrinologie",University Würzburg Endokrinologie,Klinikum Grohadern Medizinische Klinik und Polandiklinik II,Uniklinik Koln Studienzentrum der Klinik I für Innere Medizin,Universitytsklinikum Leipzig Medizinische Klinik und Polandiklinik III,Charité Campus Virchow-Klinik Charité Campus Virchow-KlinikumAbteilung für Nuklear-Medizin Charitéplatz 1,"Dipartimento di Medicina Interna, Scienze Endocrino-Metaboliche e Biochimica Sezione di Endocrinologia e Malattie Metaboliche","A.O. Osp Niguarda Ca' Granda Oncologia Medica FalckPiazza Ospedale Maggiore, 3","A.O.U. Pisana EndocrinologiaDip. Endocrinologia e MetabolismoOspedale CisanelloVia Paradisea, 2","Sezione di Medicina Interna e Scienze Endocrine e Metaboliche - Dipartimento di Medicina Interna D.I.M.I – Università degli Studi di Perugia -Via Enrico dal Pozzo s/n, 06126 - Perugia - Italyly","Ist. Oncologico Mediterraneo Dip. OncologicoVia Penninazzo, 7","IRCCS Ca' Granda Osp. Maggiore Endocrinologia e DiabetologiaVia Francencesco Sforza, 35","Unità Funzionale di Patologia Neuroendocrina –Dipartimento di Endocrinologia ed Oncologia Molecolare e Clinica, Facoltà di Medicina e Chirurgia Azienda Ospedaliera UniversItalyria “Federico II” di NaPolandi","A.O.U. Integrata Verona Oncologia MedicaPolandiclinico G.B. Rossi (Borgo Roma)Piazzale L. Scuro, 10",IRCCS Ist Nazionale Tumori MI Oncologia Medica 3,Osp Sacro Cuore Don Calabria Endocrinologia,"Dipartimento di Scienze Endocrinologiche e mediche (Di.S.E.M.), Università degli studi di Genova,",National Cancer Center HospItalyl East Division of Head and Neck Internal Medicine,Aichi Cancer Center HospItalyl Head and Neck Surgery Department,Nagoya University HospItalyl Department of Clinical Oncology and Chemotherapy 65 Tsurumai-cho Showa-ku,Asan Medical Center Department of Endocrinology,"Samsung Medical Center Department of endocrinology and metabolism, Internal medicine",St. Mary HospItalyl Seoul St. Mary's HospItalyl Department of Endocrinology,"Severance HospItalyl Department of Endocrinology,   Yonsei University College of medicine",Seoul National University Hosp Department of Endocrinology,"Chung Nam Department of Endocrinology, Chungnam National University HospItalyl,",UMCG Department of Endocrinology,"LUMC Afd. Klinische Oncologie K1-P, Albinusdreef 2","SP SzpItalyl Kliniczny nr 2 Oddzial Kliniczny Endokrynologii, Przemiany Materii i Chorob Wewnetrznychul. Przybyszewskiego 49",Wojskowy Instytut Medyczny Klinika Endokrynologii i Terapii Izotopowej,Centrum Onkologii Zaklad Medycyny Nuklearnej i Endokrynologii Onkologicznejul. Roentgena 5,Centrum Onkologii - Instityt  Zaklad Medycyny Nuklearnej i Endokrynologii Onkologicznej,"Medical Radiological Research Centre of Minzdravsocrazvitie, FGBU,  department of radio surgical treatment by sheltered radio nuclides",Altay Oncological Dispensary Head and neck department,King Faisal Specialist Hosp. PO Box 3354,H. Puerta de Hierro Servicio de Oncología Médica,HospItalyl de la Vall d'Hebron Servicio de Oncología Médica,HospItalyl de la Vall d'Hebron Servicio de Oncología Médica,HospItalyl de Bellvitge Secretaria de Consultas Externas,HospItalyl Central de Asturias Servicio de Endocrinología,Sahlgrenska Universitetssjukh JubileumsklinikenTyroideaenheten,Skones Universitetssjukhus Skoes onkologiska klinik,Universitetssjukhuset Onkologiska kliniken,Sektionen foer Huvud-hals och Thorax Onkologiska Kliniken,Royal Marsden HospItalyl(London) Head and Neck Unit3rd Floor Granard House 203 Fulham Road,Guy's HospItalyl Department of Nuclear Medicine,St James' HospItalyl St James？s Institute of Oncology Level 4 Bexley WingSt James？s University,Freeman HospItalyl Sir Bobby Robson Cancer Trials Research Centre,Velindre HospItalyl Velindre Cancer Centre,"Christie HospItalyl CRC Department of Medical Oncology, Christie CRC Research Centre",Royal Marsden Head And Neck 3rd Floor Orchard House,Aberdeen Royal Infirmary Ancho Anchor Unit- Clinic D,Beatson West of Scotland,Vanderbilt University Med. Ctr Vanderbilt - Ingram Cancer Center777 Preston Research Building,Medical Oncology Washington University School of Medicine,Boston Medical Center 820 Harrison Avenue,Dana-Farber Cancer Institute 44 Binney Street,"HospItalyl of the University of Pennsylvania Clinical Research Building, Room 127",M.D. Anderson Cancer Center 1515 Holcombe Boulevard,"Yale University, School of Medicine Surgical Oncology",Seattle Cancer Care Alliance 825 Eastlake Ave. E. G4-940,Stanford HospItalyl & Clinics Stanford Cancer Center,UPMC Health System Hillman Cancer Center,Ohio State University Med Ctr James Cancer HospItalyl,Oregon Health & Science Univ. Knight Cancer Institute,Univ of Michigan Health System Department of Oncology,Univ of New Mexico Cancer Ctr. 1201 Camino de Salud 1 University of New Mexico,Cedars-Sinai Medical Center Samuel Oschin Cancer Center,Emory University Winship Cancer Institute,Mount Sinai Medical Center One Gustave L. Levy Place,复旦大学附属肿瘤医院,上海仁济医院,The Cancer Institute Hospital of JFCR Department of Medical Oncology,浙江肿瘤医院,复旦大学附属肿瘤医院,四川大学华西医院,中国医学科学院肿瘤医院,北京协和医院,中山大学肿瘤防治中心,上海仁济医院
2014-05-08,CTR20130039,行气活血，化瘀通络。用于治疗神经根型颈椎病的气滞血瘀证，症见颈项强痛，肩臂疼痛，手臂酸胀，手臂窜麻，上肢乏力，头痛，头昏。,陕西中医学院附属医院,陕西中医学院附属医院,广西中医学院附属瑞康医院,湖南中医药大学第二附属医院,湖北省中医院,湖南中医药大学第二附属医院,湖北省中医院,陕西中医学院附属医院,广西瑞康医院
2014-01-22,CTR20130048,痛风、高尿酸血症,北京协和医院,北京协和医院,哈尔滨医科大学附属第二医院,安徽省立医院,苏州大学附属第二医院,上海长海医院,上海华山医院,复旦大学附属中山医院,上海市第十人民医院,西安交通大学第一附属医院,华中科技大学同济医学院附属同济医院,岳阳市一人民医院,中南大学湘雅三医院,安徽医科大学第一附属医院,上海中医药大学附属岳阳中西医结合医院,西安交通大学第一附属医院,哈尔滨医科大学附属第二医院,北京协和医院,苏州大学附属第二医院
2013-05-20,CTR20130036,治疗由A、B型病毒等引起的上呼吸道感染。,,中南大学湘雅三医院Ⅰ期临床研究室
2013-03-27,CTR20130051,适用于各种原因引起的中、重度急、慢性疼痛,,湖南泰格湘雅药物研究有限公司,中南大学湘雅三医院Ⅰ期临床研究室,浙江众益药业有限公司
2014-08-25,CTR20130052,缬沙坦适用于各类轻至中度高血压，尤其适用于对ACE抑制剂不耐受的患者。,中南大学,中南大学湘雅三医院Ⅰ期临床研究室,湖南泰格湘雅药物研究有限公司
2014-02-10,CTR20130047,急性单纯性尿路感染，复杂性尿路感染,复旦大学附属华山医院,复旦大学附属华山医院,福建医科大学附属协和医院,上海交通大学医学院附属仁济医院,中国医科大学附属盛京医院,第三军医大学第一附属医院（西南医院）,北京协和医院,桂林医学院附属医院,广西自治区人民医院,四川大学华西医院,中国人民解放军沈阳军区总医院,中南大学湘雅三医院,长沙市中心医院,武汉大学中南医院,山西医科大学第二医院,海南医学院附属医院,海口市人民医院,上海交通大学医学院附属瑞金医院,福建医科大学附属协和医院,海口市人民医院,海南医学院附属医院,山西医科大学第二医院,武汉大学中南医院,长沙市中心医院,中南大学湘雅三医院,中国人民解放军沈阳军区总医院,四川大学华西医院,广西自治区人民医院,桂林医学院附属医院,北京协和医院,第三军医大学第一附属医院（西南医院）,中国医科大学附属盛京医院,上海交通大学医学院附属仁济医院,复旦大学附属华山医院,上海交通大学医学院附属瑞金医院
2013-03-26,CTR20130049,本品适用于经饮食控制和其他非药物治疗（如：运动治疗、减轻体重）仍不能适当控制血脂异常的原发性高胆固醇血症（IIa型，包括杂合子家族性高胆固醇血症）或混合型血脂异常症（IIb型）。 也适用于纯合子家族性高胆固醇血症的患者作为饮食控制和其他降血脂措施（如LDL去除疗法）的辅助治疗，或在这些方法不适用时使用。,,兰州大学第一医院
2013-04-16,CTR20130050,高血压，可单独使用本品治疗也可与其它抗高血压药物合用；慢性稳定性心绞痛及变异型心绞痛，可单独使用本品治疗也可与其它抗心绞痛药物合用。,,辽宁省人民医院药物临床试验机构
2013-04-09,CTR20130053,治疗利妥昔单抗治疗失败的B细胞惰性淋巴瘤,,北京大学人民医院,北京大学第一医院,上海交通大学医学院附属仁济医院,复旦大学附属华山医院,东南大学附属中大医院,中国人民解放军兰州军区兰州总医院,无锡市第一人民医院,济南市中心医院,青岛大学医学院附属医院,中国人民解放军第四军医大学唐都医院,南昌大学第二附属医院,徐州医学院附属医院
2015-01-13,CTR20130059,非小细胞肺癌。,National Cancer Center Hospital,National Cancer Center Hospital,近畿大学医学部附属医院,静冈县立静冈癌症中心,上海市胸科医院,国立大学医学院附属医院,中国医学科学院肿瘤医院,中山大学肿瘤防治中心,Chinese University of HongKong,上海市胸科医院,中山大学肿瘤防治中心,中国医学科学院肿瘤医院,国立台湾大学医学院附属医院,Chinese University of HongKong,静冈县立静冈癌症中心,国立癌症研究中心中央医院,近畿大学医学部附属医院
